Sheet: Legally_Operating_Businesses (3)
A1: DCA License Number | B1: License Type | C1: License Expiration Date | D1: License Status | E1: License Creation Date | F1: Industry | G1: Business Name | H1: Business Name 2 | I1: Address Building | J1: Address Street Name | K1: Secondary Address Street Name | L1: Address City | M1: Address State | N1: Address ZIP | O1: Contact Phone Number | P1: Address Borough | Q1: Borough Code | R1: Community Board | S1: Council District | T1: BIN | U1: BBL | V1: NTA | W1: Census Tract | X1: Detail | Z1: Longitude | AA1: Latitude | AB1: Location | AC1: Zip Codes | AD1: Community Districts | AE1: Borough Boundaries | AF1: City Council Districts | AG1: Police Precincts
A2: 2090542-DCA | B2: Business | C2: 03/31/2023 | D2: Active | E2: 09/16/2019 | F2: Garage | G2: SP PLUS CORPORATION | I2: 131 | J2: AMSTERDAM AVE | L2: NEW YORK | M2: NY | N2: 10023 | O2: 2126954568 | P2: Manhattan | Q2: 1 | R2: 107 | S2: 6 | T2: 1077844 | U2: 1011377501 | V2: MN14 | W2: 149 | X2: Vehicle Spaces: 375, Bicycle Spaces: 21 | Y2: of:==VALUE(MID([.X2];FIND("Vehicle Spaces:";[.X2])+LEN("Vehicle Spaces:");FIND(",";[.X2];FIND("Vehicle Spaces:";[.X2]))-FIND("Vehicle Spaces:";[.X2])-LEN("Vehicle Spaces:"))) -> 375 | Z2: -73.9846193256206 | AA2: 40.77450438766 | AB2: (40.77450438765997, -73.98461932562064) | AC2: 12420 | AD2: 20 | AE2: 4 | AF2: 19 | AG2: 12
A3: 0761016-DCA | B3: Business | C3: 03/31/2023 | D3: Active | E3: 05/11/2006 | F3: Garage | G3: 64TH WEST END PARKING LLC | I3: 110 | J3: W END AVE | L3: NEW YORK | M3: NY | N3: 10023 | O3: 2126869800 | P3: Manhattan | Q3: 1 | R3: 107 | S3: 6 | T3: 1030339 | U3: 1011560001 | V3: MN14 | W3: 151 | X3: Vehicle Spaces: 106, Bicycle Spaces: 10 | Y3: of:==VALUE(MID([.X3];FIND("Vehicle Spaces:";[.X3])+LEN("Vehicle Spaces:");FIND(",";[.X3];FIND("Vehicle Spaces:";[.X3]))-FIND("Vehicle Spaces:";[.X3])-LEN("Vehicle Spaces:"))) -> 106 | Z3: -73.9878903174361 | AA3: 40.7751058754006 | AB3: (40.77510587540059, -73.9878903174361) | AC3: 12420 | AD3: 20 | AE3: 4 | AF3: 19 | AG3: 12
A4: 0736176-DCA | B4: Business | C4: 03/31/2023 | D4: Active | E4: 05/17/2006 | F4: Garage | G4: AMSTERDAM GARAGE LLC | I4: 621 | J4: AMSTERDAM AVE | L4: NEW YORK | M4: NY | N4: 10024 | O4: 2128748983 | P4: Manhattan | Q4: 1 | R4: 107 | S4: 6 | T4: 1032489 | U4: 1012210001 | V4: MN12 | W4: 177 | X4: Vehicle Spaces: 90, Bicycle Spaces: 9 | Y4: of:==VALUE(MID([.X4];FIND("Vehicle Spaces:";[.X4])+LEN("Vehicle Spaces:");FIND(",";[.X4];FIND("Vehicle Spaces:";[.X4]))-FIND("Vehicle Spaces:";[.X4])-LEN("Vehicle Spaces:"))) -> 90 | Z4: -73.9730340637031 | AA4: 40.7903832931496 | AB4: (40.79038329314962, -73.97303406370311) | AC4: 12421 | AD4: 20 | AE4: 4 | AF4: 19 | AG4: 15
A5: 2056044-DCA | B5: Business | C5: 03/31/2023 | D5: Active | E5: 07/20/2017 | F5: Garage | G5: SP PLUS CORPORATION | I5: 699 | J5: W END AVE | L5: NEW YORK | M5: NY | N5: 10025 | O5: 2125025490 | P5: Manhattan | Q5: 1 | R5: 107 | S5: 6 | T5: 1034136 | U5: 1012520057 | V5: MN12 | W5: 179 | X5: Vehicle Spaces: 54, Bicycle Spaces: 5 | Y5: of:==VALUE(MID([.X5];FIND("Vehicle Spaces:";[.X5])+LEN("Vehicle Spaces:");FIND(",";[.X5];FIND("Vehicle Spaces:";[.X5]))-FIND("Vehicle Spaces:";[.X5])-LEN("Vehicle Spaces:"))) -> 54 | Z5: -73.9742389072248 | AA5: 40.7938638869806 | AB5: (40.793863886980645, -73.97423890722479) | AC5: 12422 | AD5: 20 | AE5: 4 | AF5: 19 | AG5: 15
A6: 0368337-DCA | B6: Business | C6: 03/31/2023 | D6: Active | E6: 05/11/2006 | F6: Garage | G6: 165 WEST 66TH STREET PARKING LLC | I6: 165 | J6: W 66TH ST | L6: NEW YORK | M6: NY | N6: 10023 | O6: 212-686-9800 | P6: Manhattan | Q6: 1 | R6: 107 | S6: 6 | T6: 1028837 | U6: 1011380001 | V6: MN14 | W6: 153 | X6: Vehicle Spaces: 77, Bicycle Spaces: 7 | Y6: of:==VALUE(MID([.X6];FIND("Vehicle Spaces:";[.X6])+LEN("Vehicle Spaces:");FIND(",";[.X6];FIND("Vehicle Spaces:";[.X6]))-FIND("Vehicle Spaces:";[.X6])-LEN("Vehicle Spaces:"))) -> 77 | Z6: -73.9835578553596 | AA6: 40.7744520910656 | AB6: (40.77445209106563, -73.98355785535958) | AC6: 12420 | AD6: 20 | AE6: 4 | AF6: 19 | AG6: 12
A7: 0838371-DCA | B7: Business | C7: 03/31/2023 | D7: Active | E7: 05/18/2006 | F7: Garage | G7: CONVENIENT PARKING LLC | I7: 215 | J7: W 95TH ST | L7: NEW YORK | M7: NY | N7: 10025 | O7: 2126869800 | P7: Manhattan | Q7: 1 | R7: 107 | S7: 6 | T7: 1071159 | U7: 1012430501 | V7: MN12 | W7: 183 | X7: Vehicle Spaces: 77, Bicycle Spaces: 8 | Y7: of:==VALUE(MID([.X7];FIND("Vehicle Spaces:";[.X7])+LEN("Vehicle Spaces:");FIND(",";[.X7];FIND("Vehicle Spaces:";[.X7]))-FIND("Vehicle Spaces:";[.X7])-LEN("Vehicle Spaces:"))) -> 77 | Z7: -73.9714292318237 | AA7: 40.7936299227344 | AB7: (40.793629922734425, -73.97142923182369) | AC7: 12422 | AD7: 20 | AE7: 4 | AF7: 19 | AG7: 15
A8: 2053019-DCA | B8: Business | C8: 03/31/2023 | D8: Active | E8: 05/16/2017 | F8: Garage | G8: COLUMBUS 95 PARKING LLC | I8: 730 | J8: COLUMBUS AVE | L8: NEW YORK | M8: NY | N8: 10025 | O8: 2126869800 | P8: Manhattan | Q8: 1 | R8: 107 | S8: 6 | T8: 1082743 | U8: 1012260029 | V8: MN12 | W8: 181 | X8: Vehicle Spaces: 44, Bicycle Spaces: 0 | Y8: of:==VALUE(MID([.X8];FIND("Vehicle Spaces:";[.X8])+LEN("Vehicle Spaces:");FIND(",";[.X8];FIND("Vehicle Spaces:";[.X8]))-FIND("Vehicle Spaces:";[.X8])-LEN("Vehicle Spaces:"))) -> 44 | Z8: -73.9677098481034 | AA8: 40.7926271142759 | AB8: (40.792627114275895, -73.96770984810344) | AC8: 12422 | AD8: 20 | AE8: 4 | AF8: 19 | AG8: 15
A9: 1416502-DCA | B9: Business | C9: 03/31/2023 | D9: Active | E9: 01/04/2012 | F9: Garage | G9: ASPEN 36 LLC | I9: 400 | J9: W 63RD ST | L9: NEW YORK | M9: NY | N9: 10069 | O9: 2126869800 | P9: Manhattan | Q9: 1 | R9: 107 | S9: 6 | T9: 1088271 | U9: 1011710148 | V9: MN14 | W9: 151 | X9: Vehicle Spaces: 118, Bicycle Spaces: 11 | Y9: of:==VALUE(MID([.X9];FIND("Vehicle Spaces:";[.X9])+LEN("Vehicle Spaces:");FIND(",";[.X9];FIND("Vehicle Spaces:";[.X9]))-FIND("Vehicle Spaces:";[.X9])-LEN("Vehicle Spaces:"))) -> 118 | Z9: -73.9899519907565 | AA9: 40.7746641708642 | AB9: (40.774664170864156, -73.98995199075645) | AC9: 10091 | AD9: 20 | AE9: 4 | AF9: 19 | AG9: 12
A10: 2051057-DCA | B10: Business | C10: 03/31/2023 | D10: Active | E10: 04/12/2017 | F10: Garage | G10: COLUMBIA GARAGE LLC | I10: 2561/2579 | J10: BROADWAY | L10: NEW YORK | M10: NY | N10: 10025 | O10: 6465840409 | P10: Manhattan | Q10: 1 | R10: 107 | S10: 6 | T10: 1056068 | U10: 1018687501 | X10: Vehicle Spaces: 200, Bicycle Spaces: 20 | Y10: of:==VALUE(MID([.X10];FIND("Vehicle Spaces:";[.X10])+LEN("Vehicle Spaces:");FIND(",";[.X10];FIND("Vehicle Spaces:";[.X10]))-FIND("Vehicle Spaces:";[.X10])-LEN("Vehicle Spaces:"))) -> 200 | Z10: -73.9717176756635 | AA10: 40.7947553330105 | AB10: (40.79475533301053, -73.97171767566347) | AC10: 12422 | AD10: 20 | AE10: 4 | AF10: 19 | AG10: 15
A11: 0819247-DCA | B11: Business | C11: 03/31/2023 | D11: Active | E11: 05/17/2006 | F11: Garage | G11: RELIANT PARKING LLC | I11: 225 | J11: W 83RD ST | L11: NEW YORK | M11: NY | N11: 10024 | O11: 2126869800 | P11: Manhattan | Q11: 1 | R11: 107 | S11: 6 | T11: 1084303 | U11: 1012310501 | V11: MN12 | W11: 171 | X11: Vehicle Spaces: 107, Bicycle Spaces: 10 | Y11: of:==VALUE(MID([.X11];FIND("Vehicle Spaces:";[.X11])+LEN("Vehicle Spaces:");FIND(",";[.X11];FIND("Vehicle Spaces:";[.X11]))-FIND("Vehicle Spaces:";[.X11])-LEN("Vehicle Spaces:"))) -> 107 | Z11: -73.9775099377561 | AA11: 40.7861985370306 | AB11: (40.78619853703055, -73.97750993775612) | AC11: 12421 | AD11: 20 | AE11: 4 | AF11: 19 | AG11: 12
A12: 2105919-DCA | B12: Business | C12: 03/31/2023 | D12: Active | E12: 05/11/2022 | F12: Garage | G12: LTG PARKING CORP. | I12: 165 | J12: W END AVE | L12: NEW YORK | M12: NY | N12: 10023 | O12: 212-686-9800 | P12: Manhattan | Q12: 1 | R12: 107 | S12: 6 | T12: 1070746 | U12: 1011797501 | X12: Vehicle Spaces: 445, Bicycle Spaces: 22 | Y12: of:==VALUE(MID([.X12];FIND("Vehicle Spaces:";[.X12])+LEN("Vehicle Spaces:");FIND(",";[.X12];FIND("Vehicle Spaces:";[.X12]))-FIND("Vehicle Spaces:";[.X12])-LEN("Vehicle Spaces:"))) -> 445 | Z12: -73.9865215433328 | AA12: 40.7770188052264 | AB12: (40.77701880522641, -73.98652154333283) | AC12: 12420 | AD12: 20 | AE12: 4 | AF12: 19 | AG12: 12
A13: 0901540-DCA | B13: Business | C13: 03/31/2023 | D13: Active | E13: 03/26/1997 | F13: Garage | G13: 9-11 WEST 100TH STREET CORP. | I13: 9-11 | J13: W 100TH ST | L13: NEW YORK | M13: NY | N13: 10025 | O13: 2128661000 | P13: Manhattan | Q13: 1 | R13: 107 | S13: 7 | T13: 1055299 | U13: 1018360027 | X13: Vehicle Spaces: 75, Bicycle Spaces: 8 | Y13: of:==VALUE(MID([.X13];FIND("Vehicle Spaces:";[.X13])+LEN("Vehicle Spaces:");FIND(",";[.X13];FIND("Vehicle Spaces:";[.X13]))-FIND("Vehicle Spaces:";[.X13])-LEN("Vehicle Spaces:"))) -> 75 | Z13: -73.9631295456625 | AA13: 40.7943576647149 | AB13: (40.79435766471489, -73.96312954566253) | AC13: 12422 | AD13: 20 | AE13: 4 | AF13: 23 | AG13: 15
A14: 2102636-DCA | B14: Business | C14: 03/31/2023 | D14: Active | E14: 11/16/2021 | F14: Garage and Parking Lot | G14: 107 PARK OPS LLC | I14: 102 | J14: W 107TH ST | L14: NEW YORK | M14: NY | N14: 10025 | O14: 9177838974 | P14: Manhattan | Q14: 1 | R14: 107 | S14: 8 | T14: 1055973 | U14: 1018610037 | X14: Vehicle Spaces: 188, Bicycle Spaces: 18 | Y14: of:==VALUE(MID([.X14];FIND("Vehicle Spaces:";[.X14])+LEN("Vehicle Spaces:");FIND(",";[.X14];FIND("Vehicle Spaces:";[.X14]))-FIND("Vehicle Spaces:";[.X14])-LEN("Vehicle Spaces:"))) -> 188 | Z14: -73.9628482478297 | AA14: 40.8001050356465 | AB14: (40.800105035646524, -73.96284824782974) | AC14: 12422 | AD14: 20 | AE14: 4 | AF14: 23 | AG14: 15
A15: 2106005-DCA | B15: Business | C15: 03/31/2023 | D15: Active | E15: 05/13/2022 | F15: Garage | G15: QUIK PARK HUDSON VI LLC | I15: 40 | J15: RIVERSIDE BLVD | L15: NEW YORK | M15: NY | N15: 10069 | O15: 212-686-9800 | P15: Manhattan | Q15: 1 | R15: 107 | S15: 6 | T15: 1089742 | U15: 1011717509 | X15: Vehicle Spaces: 180, Bicycle Spaces: 18 | Y15: of:==VALUE(MID([.X15];FIND("Vehicle Spaces:";[.X15])+LEN("Vehicle Spaces:");FIND(",";[.X15];FIND("Vehicle Spaces:";[.X15]))-FIND("Vehicle Spaces:";[.X15])-LEN("Vehicle Spaces:"))) -> 180 | Z15: -73.9917464625062 | AA15: 40.7742169211075 | AB15: (40.774216921107524, -73.9917464625062) | AC15: 10091 | AD15: 20 | AE15: 4 | AF15: 19 | AG15: 12
A16: 0959098-DCA | B16: Business | C16: 03/31/2023 | D16: Active | E16: 04/23/1997 | F16: Garage | G16: COPLEY ASSOCIATES, LLC | H16: COPLEY GARAGE | I16: 2000 | J16: BROADWAY | L16: NEW YORK | M16: NY | N16: 10023 | O16: 212-888-7400 | P16: Manhattan | Q16: 1 | R16: 107 | S16: 6 | T16: 1070362 | U16: 1011400502 | V16: MN14 | W16: 153 | X16: Vehicle Spaces: 57, Bicycle Spaces: 5 | Y16: of:==VALUE(MID([.X16];FIND("Vehicle Spaces:";[.X16])+LEN("Vehicle Spaces:");FIND(",";[.X16];FIND("Vehicle Spaces:";[.X16]))-FIND("Vehicle Spaces:";[.X16])-LEN("Vehicle Spaces:"))) -> 57 | Z16: -73.9821494568458 | AA16: 40.7756074160266 | AB16: (40.775607416026595, -73.98214945684576) | AC16: 12420 | AD16: 20 | AE16: 4 | AF16: 19 | AG16: 12
A17: 1181333-DCA | B17: Business | C17: 03/31/2023 | D17: Active | E17: 09/28/2004 | F17: Garage | G17: SAVANNAH GARAGE, LLC | I17: 250 | J17: W 89TH ST | L17: NEW YORK | M17: NY | N17: 10024 | O17: 212-888-7400 | P17: Manhattan | Q17: 1 | R17: 107 | S17: 6 | T17: 1071151 | U17: 1012360501 | V17: MN12 | W17: 175 | X17: Vehicle Spaces: 52, Bicycle Spaces: 5 | Y17: of:==VALUE(MID([.X17];FIND("Vehicle Spaces:";[.X17])+LEN("Vehicle Spaces:");FIND(",";[.X17];FIND("Vehicle Spaces:";[.X17]))-FIND("Vehicle Spaces:";[.X17])-LEN("Vehicle Spaces:"))) -> 52 | Z17: -73.9755367146918 | AA17: 40.7904195330229 | AB17: (40.79041953302292, -73.97553671469177) | AC17: 12421 | AD17: 20 | AE17: 4 | AF17: 19 | AG17: 15
A18: 2001881-DCA | B18: Business | C18: 03/31/2023 | D18: Active | E18: 12/23/2013 | F18: Garage and Parking Lot | G18: LAUREATE GARAGE, LLC | I18: 2148 | J18: BROADWAY | L18: NEW YORK | M18: NY | N18: 10023 | O18: 2127502056 | P18: Manhattan | Q18: 1 | R18: 107 | S18: 6 | T18: 1088786 | U18: 1011677502 | V18: MN12 | W18: 163 | X18: Vehicle Spaces: 155, Bicycle Spaces: 16 | Y18: of:==VALUE(MID([.X18];FIND("Vehicle Spaces:";[.X18])+LEN("Vehicle Spaces:");FIND(",";[.X18];FIND("Vehicle Spaces:";[.X18]))-FIND("Vehicle Spaces:";[.X18])-LEN("Vehicle Spaces:"))) -> 155 | Z18: -73.9811765866216 | AA18: 40.78138493087 | AB18: (40.781384930869976, -73.98117658662161) | AC18: 12420 | AD18: 20 | AE18: 4 | AF18: 19 | AG18: 12
A19: 1315856-DCA | B19: Business | C19: 03/31/2023 | D19: Active | E19: 04/27/2009 | F19: Garage | G19: 44 WEST 62ND GARAGE PARTNERS, LLC | I19: 44 | J19: W 62ND ST | L19: NEW YORK | M19: NY | N19: 10023 | O19: 2122623800 | P19: Manhattan | Q19: 1 | R19: 107 | S19: 6 | T19: 1027365 | U19: 1011140061 | V19: MN14 | W19: 145 | X19: Vehicle Spaces: 143, Bicycle Spaces: 14 | Y19: of:==VALUE(MID([.X19];FIND("Vehicle Spaces:";[.X19])+LEN("Vehicle Spaces:");FIND(",";[.X19];FIND("Vehicle Spaces:";[.X19]))-FIND("Vehicle Spaces:";[.X19])-LEN("Vehicle Spaces:"))) -> 143 | Z19: -73.982620094432 | AA19: 40.7707547905183 | AB19: (40.7707547905183, -73.982620094432) | AC19: 12420 | AD19: 20 | AE19: 4 | AF19: 10 | AG19: 12
A20: 1061198-DCA | B20: Business | C20: 03/31/2023 | D20: Active | E20: 05/11/2006 | F20: Garage | G20: 101 WEST END PARKING LLC | I20: 101 | J20: W END AVE | L20: NEW YORK | M20: NY | N20: 10023 | O20: 2126869800 | P20: Manhattan | Q20: 1 | R20: 107 | S20: 6 | T20: 1085785 | U20: 1011710062 | V20: MN14 | W20: 151 | X20: Vehicle Spaces: 166, Bicycle Spaces: 16 | Y20: of:==VALUE(MID([.X20];FIND("Vehicle Spaces:";[.X20])+LEN("Vehicle Spaces:");FIND(",";[.X20];FIND("Vehicle Spaces:";[.X20]))-FIND("Vehicle Spaces:";[.X20])-LEN("Vehicle Spaces:"))) -> 166 | Z20: -73.9886340914814 | AA20: 40.7750647801021 | AB20: (40.77506478010212, -73.98863409148143) | AC20: 12420 | AD20: 20 | AE20: 4 | AF20: 19 | AG20: 12
A21: 0905127-DCA | B21: Business | C21: 03/31/2023 | D21: Active | E21: 03/26/1997 | F21: Garage | G21: 15 WEST 72ND STREET CORP. | I21: 15 | J21: W 72ND ST | L21: NEW YORK | M21: NY | N21: 10023 | O21: 2128661000 | P21: Manhattan | Q21: 1 | R21: 107 | S21: 6 | T21: 1028636 | U21: 1011250024 | V21: MN14 | W21: 157 | X21: Vehicle Spaces: 176, Bicycle Spaces: 18 | Y21: of:==VALUE(MID([.X21];FIND("Vehicle Spaces:";[.X21])+LEN("Vehicle Spaces:");FIND(",";[.X21];FIND("Vehicle Spaces:";[.X21]))-FIND("Vehicle Spaces:";[.X21])-LEN("Vehicle Spaces:"))) -> 176 | Z21: -73.9768235576584 | AA21: 40.7765918285516 | AB21: (40.776591828551574, -73.97682355765838) | AC21: 12420 | AD21: 20 | AE21: 4 | AF21: 19 | AG21: 12
A22: 0691393-DCA | B22: Business | C22: 03/31/2023 | D22: Active | E22: 05/15/2006 | F22: Garage | G22: KENSINGTON ENTERPRISES LLC | I22: 50 | J22: W 97TH ST | L22: NEW YORK | M22: NY | N22: 10025 | O22: 2126869800 | P22: Manhattan | Q22: 1 | R22: 107 | S22: 8 | T22: 1055265 | U22: 1018320043 | V22: MN12 | W22: 181 | X22: Vehicle Spaces: 114, Bicycle Spaces: 11 | Y22: of:==VALUE(MID([.X22];FIND("Vehicle Spaces:";[.X22])+LEN("Vehicle Spaces:");FIND(",";[.X22];FIND("Vehicle Spaces:";[.X22]))-FIND("Vehicle Spaces:";[.X22])-LEN("Vehicle Spaces:"))) -> 114 | Z22: -73.9662757888281 | AA22: 40.7932305442443 | AB22: (40.79323054424429, -73.96627578882814) | AC22: 12422 | AD22: 20 | AE22: 4 | AF22: 23 | AG22: 15
A23: 2097161-DCA | B23: Business | C23: 03/31/2023 | D23: Active | E23: 12/09/2020 | F23: Garage and Parking Lot | G23: CHAMPION PARKING CPW LLC | I23: 225 | J23: CENTRAL PARK W | L23: NEW YORK | M23: NY | N23: 10024 | P23: Manhattan | Q23: 1 | R23: 107 | S23: 6 | T23: 1031181 | U23: 1011960029 | X23: Vehicle Spaces: 58, Bicycle Spaces: 6 | Y23: of:==VALUE(MID([.X23];FIND("Vehicle Spaces:";[.X23])+LEN("Vehicle Spaces:");FIND(",";[.X23];FIND("Vehicle Spaces:";[.X23]))-FIND("Vehicle Spaces:";[.X23])-LEN("Vehicle Spaces:"))) -> 58 | Z23: -73.9709462710364 | AA23: 40.7831010096562 | AB23: (40.783101009656214, -73.97094627103644) | AC23: 12421 | AD23: 20 | AE23: 4 | AF23: 19 | AG23: 12
A24: 1416505-DCA | B24: Business | C24: 03/31/2023 | D24: Active | E24: 01/04/2012 | F24: Garage | G24: ASPEN 36 LLC | I24: 60 | J24: RIVERSIDE BLVD | L24: NEW YORK | M24: NY | N24: 10069 | O24: 2126869800 | P24: Manhattan | Q24: 1 | R24: 107 | S24: 6 | T24: 1087835 | U24: 1011710508 | V24: MN14 | W24: 151 | X24: Vehicle Spaces: 113, Bicycle Spaces: 11 | Y24: of:==VALUE(MID([.X24];FIND("Vehicle Spaces:";[.X24])+LEN("Vehicle Spaces:");FIND(",";[.X24];FIND("Vehicle Spaces:";[.X24]))-FIND("Vehicle Spaces:";[.X24])-LEN("Vehicle Spaces:"))) -> 113 | Z24: -73.9909231837608 | AA24: 40.774886575213 | AB24: (40.77488657521295, -73.99092318376078) | AC24: 10091 | AD24: 20 | AE24: 4 | AF24: 19 | AG24: 12
A25: 2093115-DCA | B25: Business | C25: 03/31/2023 | D25: Active | E25: 12/19/2019 | F25: Garage | G25: 15 CPW GARAGE LLC | I25: 1880 | J25: BROADWAY | L25: NEW YORK | M25: NY | N25: 10023 | O25: 6465840409 | P25: Manhattan | Q25: 1 | R25: 107 | S25: 3 | T25: 1087510 | U25: 1011147503 | X25: Vehicle Spaces: 162, Bicycle Spaces: 16 | Y25: of:==VALUE(MID([.X25];FIND("Vehicle Spaces:";[.X25])+LEN("Vehicle Spaces:");FIND(",";[.X25];FIND("Vehicle Spaces:";[.X25]))-FIND("Vehicle Spaces:";[.X25])-LEN("Vehicle Spaces:"))) -> 162 | Z25: -73.9821255680923 | AA25: 40.7704473040446 | AB25: (40.7704473040446, -73.98212556809227) | AC25: 12420 | AD25: 20 | AE25: 4 | AF25: 10 | AG25: 12
A26: 1431478-DCA | B26: Business | C26: 03/31/2023 | D26: Active | E26: 05/25/2012 | F26: Garage | G26: SP PLUS CORPORATION | I26: 70 | J26: W 95TH ST | L26: NEW YORK | M26: NY | N26: 10025 | O26: 2125025490 | P26: Manhattan | Q26: 1 | R26: 107 | S26: 6 | T26: 1079519 | U26: 1012080001 | V26: MN12 | W26: 181 | X26: Vehicle Spaces: 142, Bicycle Spaces: 14 | Y26: of:==VALUE(MID([.X26];FIND("Vehicle Spaces:";[.X26])+LEN("Vehicle Spaces:");FIND(",";[.X26];FIND("Vehicle Spaces:";[.X26]))-FIND("Vehicle Spaces:";[.X26])-LEN("Vehicle Spaces:"))) -> 142 | Z26: -73.9670132669623 | AA26: 40.7917540927174 | AB26: (40.79175409271742, -73.9670132669623) | AC26: 12422 | AD26: 20 | AE26: 4 | AF26: 19 | AG26: 15
A27: 2105515-DCA | B27: Business | C27: 03/31/2025 | D27: Active | E27: 04/25/2022 | F27: Garage | G27: MP 59 PARKING LLC | I27: 124 | J27: W 60TH ST | L27: NEW YORK | M27: NY | N27: 10023 | O27: 2124903460 | P27: Manhattan | Q27: 1 | R27: 107 | S27: 3 | T27: 1028827 | U27: 1011317502 | X27: Vehicle Spaces: 125, Bicycle Spaces: 13 | Y27: of:==VALUE(MID([.X27];FIND("Vehicle Spaces:";[.X27])+LEN("Vehicle Spaces:");FIND(",";[.X27];FIND("Vehicle Spaces:";[.X27]))-FIND("Vehicle Spaces:";[.X27])-LEN("Vehicle Spaces:"))) -> 125 | Z27: -73.9852304457344 | AA27: 40.7702309094556 | AB27: (40.77023090945557, -73.98523044573439) | AC27: 12420 | AD27: 20 | AE27: 4 | AF27: 10 | AG27: 12
A28: 2097822-DCA | B28: Business | C28: 03/13/2023 | D28: Active | E28: 02/25/2021 | F28: Garage | G28: 615 WEST 59TH STREET PARKING CORP | I28: 1 | J28: W END AVE | L28: NEW YORK | M28: NY | N28: 10023 | O28: 2127367171 | P28: Manhattan | Q28: 1 | R28: 107 | S28: 6 | T28: 1088869 | U28: 1011717511 | X28: Vehicle Spaces: 227, Bicycle Spaces: 20 | Y28: of:==VALUE(MID([.X28];FIND("Vehicle Spaces:";[.X28])+LEN("Vehicle Spaces:");FIND(",";[.X28];FIND("Vehicle Spaces:";[.X28]))-FIND("Vehicle Spaces:";[.X28])-LEN("Vehicle Spaces:"))) -> 227 | Z28: -73.9903965076212 | AA28: 40.7717108703154 | AB28: (40.771710870315445, -73.99039650762118) | AC28: 10091 | AD28: 20 | AE28: 4 | AF28: 19 | AG28: 12
A29: 2102486-DCA | B29: Business | C29: 03/31/2023 | D29: Active | E29: 11/08/2021 | F29: Garage | G29: SP PLUS CORPORATION | I29: 1886 | J29: BROADWAY | L29: NEW YORK | M29: NY | N29: 10023 | O29: 2123217542 | P29: Manhattan | Q29: 1 | R29: 107 | S29: 6 | T29: 1027463 | U29: 1011157503 | X29: Vehicle Spaces: 75, Bicycle Spaces: 8 | Y29: of:==VALUE(MID([.X29];FIND("Vehicle Spaces:";[.X29])+LEN("Vehicle Spaces:");FIND(",";[.X29];FIND("Vehicle Spaces:";[.X29]))-FIND("Vehicle Spaces:";[.X29])-LEN("Vehicle Spaces:"))) -> 75 | Z29: -73.9821362936104 | AA29: 40.7708398034464 | AB29: (40.77083980344637, -73.98213629361037) | AC29: 12420 | AD29: 20 | AE29: 4 | AF29: 19 | AG29: 12
A30: 0429467-DCA | B30: Business | C30: 03/31/2023 | D30: Active | E30: 03/03/1995 | F30: Garage | G30: ELEVEN RIVERSIDE DRIVE GARAGE CORP. | I30: 11 | J30: RIVERSIDE DR | L30: NEW YORK | M30: NY | N30: 10023 | O30: 2128741435 | P30: Manhattan | Q30: 1 | R30: 107 | S30: 6 | T30: 1030994 | U30: 1011840031 | V30: MN14 | W30: 159 | X30: Vehicle Spaces: 200, Bicycle Spaces: 20 | Y30: of:==VALUE(MID([.X30];FIND("Vehicle Spaces:";[.X30])+LEN("Vehicle Spaces:");FIND(",";[.X30];FIND("Vehicle Spaces:";[.X30]))-FIND("Vehicle Spaces:";[.X30])-LEN("Vehicle Spaces:"))) -> 200 | Z30: -73.9851738721567 | AA30: 40.781100062027 | AB30: (40.78110006202702, -73.98517387215675) | AC30: 12420 | AD30: 20 | AE30: 4 | AF30: 19 | AG30: 12
A31: 0920608-DCA | B31: Business | C31: 03/31/2023 | D31: Active | E31: 04/15/1997 | F31: Garage | G31: CAROUSEL PARKING CORP | I31: 201 | J31: W 75TH ST | L31: NEW YORK | M31: NY | N31: 10023 | O31: 2123085959 | P31: Manhattan | Q31: 1 | R31: 107 | S31: 6 | T31: 1030841 | U31: 1011670029 | V31: MN12 | W31: 163 | X31: Vehicle Spaces: 278, Bicycle Spaces: 21 | Y31: of:==VALUE(MID([.X31];FIND("Vehicle Spaces:";[.X31])+LEN("Vehicle Spaces:");FIND(",";[.X31];FIND("Vehicle Spaces:";[.X31]))-FIND("Vehicle Spaces:";[.X31])-LEN("Vehicle Spaces:"))) -> 278 | Z31: -73.9803535332688 | AA31: 40.7806299913291 | AB31: (40.78062999132912, -73.9803535332688) | AC31: 12420 | AD31: 20 | AE31: 4 | AF31: 19 | AG31: 12
A32: 1283824-DCA | B32: Business | C32: 03/31/2023 | D32: Active | E32: 05/01/2008 | F32: Garage | G32: CHAMPION PARKING 74 LLC. | I32: 2109 | J32: BROADWAY | L32: NEW YORK | M32: NY | N32: 10023 | O32: 2123085959 | P32: Manhattan | Q32: 1 | R32: 107 | S32: 6 | T32: 1030544 | U32: 1011650503 | V32: MN14 | W32: 159 | X32: Vehicle Spaces: 110, Bicycle Spaces: 11 | Y32: of:==VALUE(MID([.X32];FIND("Vehicle Spaces:";[.X32])+LEN("Vehicle Spaces:");FIND(",";[.X32];FIND("Vehicle Spaces:";[.X32]))-FIND("Vehicle Spaces:";[.X32])-LEN("Vehicle Spaces:"))) -> 110 | Z32: -73.981946138122 | AA32: 40.7797684049051 | AB32: (40.77976840490512, -73.98194613812201) | AC32: 12420 | AD32: 20 | AE32: 4 | AF32: 19 | AG32: 12
A33: 2098312-DCA | B33: Business | C33: 03/31/2023 | D33: Active | E33: 04/07/2021 | F33: Garage | G33: 208 WEST 88TH STREET PARKING CORP. | I33: 209 | J33: W 88TH ST | L33: NEW YORK | M33: NY | N33: 10024 | O33: 2127367171 | P33: Manhattan | Q33: 1 | R33: 107 | S33: 6 | T33: 1033300 | U33: 1012360037 | X33: Vehicle Spaces: 36, Bicycle Spaces: 0 | Y33: of:==VALUE(MID([.X33];FIND("Vehicle Spaces:";[.X33])+LEN("Vehicle Spaces:");FIND(",";[.X33];FIND("Vehicle Spaces:";[.X33]))-FIND("Vehicle Spaces:";[.X33])-LEN("Vehicle Spaces:"))) -> 36 | Z33: -73.9745187846586 | AA33: 40.789189672775 | AB33: (40.78918967277499, -73.97451878465863) | AC33: 12421 | AD33: 20 | AE33: 4 | AF33: 19 | AG33: 15
A34: 1469881-DCA | B34: Business | C34: 03/31/2023 | D34: Active | E34: 07/24/2013 | F34: Garage | G34: WEAP HOLDINGS, LLC | I34: 200 | J34: W END AVE | L34: NEW YORK | M34: NY | N34: 10023 | O34: 2129299404 | P34: Manhattan | Q34: 1 | R34: 107 | S34: 6 | T34: 1030352 | U34: 1011580506 | V34: MN14 | W34: 155 | X34: Vehicle Spaces: 76, Bicycle Spaces: 8 | Y34: of:==VALUE(MID([.X34];FIND("Vehicle Spaces:";[.X34])+LEN("Vehicle Spaces:");FIND(",";[.X34];FIND("Vehicle Spaces:";[.X34]))-FIND("Vehicle Spaces:";[.X34])-LEN("Vehicle Spaces:"))) -> 76 | Z34: -73.9851961840654 | AA34: 40.7781906450776 | AB34: (40.77819064507763, -73.98519618406543) | AC34: 12420 | AD34: 20 | AE34: 4 | AF34: 19 | AG34: 12
A35: 2093300-DCA | B35: Business | C35: 03/31/2023 | D35: Active | E35: 01/02/2020 | F35: Garage | G35: MP LINCOLN SQUARE PARKING LLC | I35: 143 | J35: W 68TH ST | L35: NEW YORK | M35: NY | N35: 10023 | O35: 2124903460 | P35: Manhattan | Q35: 1 | R35: 107 | S35: 6 | T35: 1028950 | U35: 1011407501 | X35: Vehicle Spaces: 271, Bicycle Spaces: 20 | Y35: of:==VALUE(MID([.X35];FIND("Vehicle Spaces:";[.X35])+LEN("Vehicle Spaces:");FIND(",";[.X35];FIND("Vehicle Spaces:";[.X35]))-FIND("Vehicle Spaces:";[.X35])-LEN("Vehicle Spaces:"))) -> 271 | Z35: -73.9824816213617 | AA35: 40.7756294249035 | AB35: (40.77562942490355, -73.98248162136171) | AC35: 12420 | AD35: 20 | AE35: 4 | AF35: 19 | AG35: 12
A36: 1420787-DCA | B36: Business | C36: 03/31/2023 | D36: Active | E36: 03/05/2012 | F36: Garage | G36: CHAMPION PARKING 68 LLC | I36: 80 | J36: CENTRAL PARK W | L36: NEW YORK | M36: NY | N36: 10023 | O36: 2123085959 | P36: Manhattan | Q36: 1 | R36: 107 | S36: 6 | T36: 1028458 | U36: 1011210029 | V36: MN14 | W36: 153 | X36: Vehicle Spaces: 83, Bicycle Spaces: 8 | Y36: of:==VALUE(MID([.X36];FIND("Vehicle Spaces:";[.X36])+LEN("Vehicle Spaces:");FIND(",";[.X36];FIND("Vehicle Spaces:";[.X36]))-FIND("Vehicle Spaces:";[.X36])-LEN("Vehicle Spaces:"))) -> 83 | Z36: -73.9777668718228 | AA36: 40.7737539557516 | AB36: (40.773753955751594, -73.97776687182275) | AD36: 20 | AE36: 4 | AF36: 19 | AG36: 12
A37: 2058614-DCA | B37: Business | C37: 03/31/2023 | D37: Active | E37: 09/25/2017 | F37: Garage | G37: IMPERIAL PARKING US LLC | H37: IMpark | I37: 200 | J37: W 79TH ST | L37: NEW YORK | M37: NY | N37: 10024 | O37: 2129378660 X225 | P37: Manhattan | Q37: 1 | R37: 107 | S37: 6 | T37: 1030909 | U37: 1011707501 | V37: MN12 | W37: 167 | X37: Vehicle Spaces: 95, Bicycle Spaces: 10 | Y37: of:==VALUE(MID([.X37];FIND("Vehicle Spaces:";[.X37])+LEN("Vehicle Spaces:");FIND(",";[.X37];FIND("Vehicle Spaces:";[.X37]))-FIND("Vehicle Spaces:";[.X37])-LEN("Vehicle Spaces:"))) -> 95 | Z37: -73.9785653385078 | AA37: 40.7832371706151 | AB37: (40.7832371706151, -73.97856533850779) | AC37: 12421 | AD37: 20 | AE37: 4 | AF37: 19 | AG37: 12
A38: 2081249-DCA | B38: Business | C38: 03/31/2023 | D38: Active | E38: 01/10/2019 | F38: Garage | G38: PARK 108 LLC | I38: 234 | J38: W 108TH ST | L38: NEW YORK | M38: NY | N38: 10025 | O38: 2129299404 | P38: Manhattan | Q38: 1 | R38: 107 | S38: 7 | T38: 1056667 | U38: 1018790053 | V38: MN09 | W38: 195 | X38: Vehicle Spaces: 98, Bicycle Spaces: 10 | Y38: of:==VALUE(MID([.X38];FIND("Vehicle Spaces:";[.X38])+LEN("Vehicle Spaces:");FIND(",";[.X38];FIND("Vehicle Spaces:";[.X38]))-FIND("Vehicle Spaces:";[.X38])-LEN("Vehicle Spaces:"))) -> 98 | Z38: -73.9659967065979 | AA38: 40.8022523836169 | AB38: (40.80225238361694, -73.96599670659785) | AC38: 12422 | AD38: 20 | AE38: 4 | AF38: 23 | AG38: 15
A39: 2081099-DCA | B39: Business | C39: 03/31/2023 | D39: Active | E39: 01/03/2019 | F39: Garage | G39: IMPERIAL PARKING US LLC | I39: 155 | J39: W 70TH ST | L39: NEW YORK | M39: NY | N39: 10023 | O39: 2129378660 | P39: Manhattan | Q39: 1 | R39: 107 | S39: 6 | T39: 1029749 | U39: 1011427502 | V39: MN14 | W39: 157 | X39: Vehicle Spaces: 43, Bicycle Spaces: 0 | Y39: of:==VALUE(MID([.X39];FIND("Vehicle Spaces:";[.X39])+LEN("Vehicle Spaces:");FIND(",";[.X39];FIND("Vehicle Spaces:";[.X39]))-FIND("Vehicle Spaces:";[.X39])-LEN("Vehicle Spaces:"))) -> 43 | Z39: -73.9814306189971 | AA39: 40.7768232209757 | AB39: (40.77682322097574, -73.98143061899712) | AC39: 12420 | AD39: 20 | AE39: 4 | AF39: 19 | AG39: 12
A40: 2003554-DCA | B40: Business | C40: 03/31/2023 | D40: Active | E40: 02/13/2014 | F40: Garage | G40: QP 50/70 WEST 93RD STREET LLC | I40: 50 | J40: W 93RD ST | L40: NEW YORK | M40: NY | N40: 10025 | O40: 212-832-2066 | P40: Manhattan | Q40: 1 | R40: 107 | S40: 6 | T40: 1031639 | U40: 1012060045 | V40: MN12 | W40: 177 | X40: Vehicle Spaces: 62, Bicycle Spaces: 6 | Y40: of:==VALUE(MID([.X40];FIND("Vehicle Spaces:";[.X40])+LEN("Vehicle Spaces:");FIND(",";[.X40];FIND("Vehicle Spaces:";[.X40]))-FIND("Vehicle Spaces:";[.X40])-LEN("Vehicle Spaces:"))) -> 62 | Z40: -73.9675159523857 | AA40: 40.7903242306371 | AB40: (40.79032423063705, -73.96751595238567) | AC40: 12422 | AD40: 20 | AE40: 4 | AF40: 19 | AG40: 15
A41: 0962108-DCA | B41: Business | C41: 03/31/2023 | D41: Active | E41: 05/28/1997 | F41: Garage | G41: 88TH GARAGE CORP. | I41: 100 | J41: W 89TH ST | L41: NEW YORK | M41: NY | N41: 10024 | O41: 2127367171 | P41: Manhattan | Q41: 1 | R41: 107 | S41: 6 | T41: 1032320 | U41: 1012190501 | V41: MN12 | W41: 173 | X41: Vehicle Spaces: 204, Bicycle Spaces: 20 | Y41: of:==VALUE(MID([.X41];FIND("Vehicle Spaces:";[.X41])+LEN("Vehicle Spaces:");FIND(",";[.X41];FIND("Vehicle Spaces:";[.X41]))-FIND("Vehicle Spaces:";[.X41])-LEN("Vehicle Spaces:"))) -> 204 | Z41: -73.971196661875 | AA41: 40.7885932835909 | AB41: (40.78859328359087, -73.97119666187504) | AC41: 12421 | AD41: 20 | AE41: 4 | AF41: 19 | AG41: 15
A42: 0921454-DCA | B42: Business | C42: 03/31/2023 | D42: Active | E42: 03/26/1997 | F42: Garage | G42: RAPID RIVERSIDE CORP. | H42: RAPID RIVERSIDE | I42: 70 | J42: RIVERSIDE DR | L42: NEW YORK | M42: NY | N42: 10024 | O42: 2128661000 | P42: Manhattan | Q42: 1 | R42: 107 | S42: 6 | T42: 1033717 | U42: 1012440001 | V42: MN12 | W42: 167 | X42: Vehicle Spaces: 80, Bicycle Spaces: 8 | Y42: of:==VALUE(MID([.X42];FIND("Vehicle Spaces:";[.X42])+LEN("Vehicle Spaces:");FIND(",";[.X42];FIND("Vehicle Spaces:";[.X42]))-FIND("Vehicle Spaces:";[.X42])-LEN("Vehicle Spaces:"))) -> 80 | Z42: -73.9822516659406 | AA42: 40.7849752138067 | AB42: (40.78497521380669, -73.98225166594061) | AC42: 12421 | AD42: 20 | AE42: 4 | AF42: 19 | AG42: 12
A43: 1114025-DCA | B43: Business | C43: 03/31/2023 | D43: Active | E43: 07/01/2002 | F43: Garage | G43: WEST 90TH GARAGE CORP. | I43: 101 | J43: W 90TH ST | L43: NEW YORK | M43: NY | N43: 10024 | O43: 2127367171 | P43: Manhattan | Q43: 1 | R43: 107 | S43: 6 | T43: 1032490 | U43: 1012210029 | V43: MN12 | W43: 177 | X43: Vehicle Spaces: 64, Bicycle Spaces: 6 | Y43: of:==VALUE(MID([.X43];FIND("Vehicle Spaces:";[.X43])+LEN("Vehicle Spaces:");FIND(",";[.X43];FIND("Vehicle Spaces:";[.X43]))-FIND("Vehicle Spaces:";[.X43])-LEN("Vehicle Spaces:"))) -> 64 | Z43: -73.9703839070245 | AA43: 40.7890953635438 | AB43: (40.789095363543794, -73.97038390702454) | AC43: 12421 | AD43: 20 | AE43: 4 | AF43: 19 | AG43: 15
A44: 2003461-DCA | B44: Business | C44: 03/31/2023 | D44: Active | E44: 02/11/2014 | F44: Garage | G44: QP 50/70 WEST 93RD STREET LLC | I44: 70 | J44: W 93RD ST | L44: NEW YORK | M44: NY | N44: 10025 | O44: 212-832-2066 | P44: Manhattan | Q44: 1 | R44: 107 | S44: 6 | T44: 1031627 | U44: 1012060001 | V44: MN12 | W44: 177 | X44: Vehicle Spaces: 88, Bicycle Spaces: 9 | Y44: of:==VALUE(MID([.X44];FIND("Vehicle Spaces:";[.X44])+LEN("Vehicle Spaces:");FIND(",";[.X44];FIND("Vehicle Spaces:";[.X44]))-FIND("Vehicle Spaces:";[.X44])-LEN("Vehicle Spaces:"))) -> 88 | Z44: -73.9679275623691 | AA44: 40.7904972639823 | AB44: (40.79049726398225, -73.96792756236911) | AC44: 12422 | AD44: 20 | AE44: 4 | AF44: 19 | AG44: 15
A45: 0901088-DCA | B45: Business | C45: 03/31/2023 | D45: Active | E45: 07/27/1998 | F45: Garage | G45: LTG PARKING CORP. | I45: 150 | J45: W END AVE | L45: NEW YORK | M45: NY | N45: 10023 | O45: 212-686-9800 | P45: Manhattan | Q45: 1 | R45: 107 | S45: 6 | T45: 1070703 | U45: 1011580503 | V45: MN14 | W45: 155 | X45: Vehicle Spaces: 163, Bicycle Spaces: 16 | Y45: of:==VALUE(MID([.X45];FIND("Vehicle Spaces:";[.X45])+LEN("Vehicle Spaces:");FIND(",";[.X45];FIND("Vehicle Spaces:";[.X45]))-FIND("Vehicle Spaces:";[.X45])-LEN("Vehicle Spaces:"))) -> 163 | Z45: -73.9866840729705 | AA45: 40.7767608188615 | AB45: (40.776760818861504, -73.98668407297048) | AC45: 12420 | AD45: 20 | AE45: 4 | AF45: 19 | AG45: 12
A46: 2096223-DCA | B46: Business | C46: 03/31/2023 | D46: Active | E46: 08/18/2020 | F46: Garage | G46: 600 COLUMBUS PARKING CORP | I46: 600 | J46: COLUMBUS AVE | L46: NEW YORK | M46: NY | N46: 10024 | O46: 2127367171 | P46: Manhattan | Q46: 1 | R46: 107 | S46: 6 | T46: 1032439 | U46: 1012200029 | X46: Vehicle Spaces: 101, Bicycle Spaces: 10 | Y46: of:==VALUE(MID([.X46];FIND("Vehicle Spaces:";[.X46])+LEN("Vehicle Spaces:");FIND(",";[.X46];FIND("Vehicle Spaces:";[.X46]))-FIND("Vehicle Spaces:";[.X46])-LEN("Vehicle Spaces:"))) -> 101 | Z46: -73.971037744156 | AA46: 40.7886453936731 | AB46: (40.78864539367313, -73.97103774415604) | AC46: 12421 | AD46: 20 | AE46: 4 | AF46: 19 | AG46: 15
A47: 1464646-DCA | B47: Business | C47: 03/31/2023 | D47: Active | E47: 05/15/2013 | F47: Garage and Parking Lot | G47: DISCOVER 97 PARKING LLC | I47: 750 | J47: COLUMBUS AVE | L47: NEW YORK | M47: NY | N47: 10025 | O47: 2126869800 | P47: Manhattan | Q47: 1 | R47: 107 | S47: 8 | T47: 1079308 | U47: 1018510501 | V47: MN12 | W47: 181 | X47: Vehicle Spaces: 80, Bicycle Spaces: 8 | Y47: of:==VALUE(MID([.X47];FIND("Vehicle Spaces:";[.X47])+LEN("Vehicle Spaces:");FIND(",";[.X47];FIND("Vehicle Spaces:";[.X47]))-FIND("Vehicle Spaces:";[.X47])-LEN("Vehicle Spaces:"))) -> 80 | Z47: -73.9672328139575 | AA47: 40.7932774807004 | AB47: (40.79327748070041, -73.9672328139575) | AC47: 12422 | AD47: 20 | AE47: 4 | AF47: 23 | AG47: 15
A48: 2050301-DCA | B48: Business | C48: 03/31/2023 | D48: Active | E48: 03/29/2017 | F48: Garage | G48: 10 WEST 66TH STREET CAR PARK LLC | H48: GGMC | I48: 10 | J48: W 66TH ST | L48: NEW YORK | M48: NY | N48: 10023 | O48: 2129966363 | P48: Manhattan | Q48: 1 | R48: 107 | S48: 6 | T48: 1028163 | U48: 1011180022 | V48: MN14 | W48: 149 | X48: Vehicle Spaces: 195, Bicycle Spaces: 20 | Y48: of:==VALUE(MID([.X48];FIND("Vehicle Spaces:";[.X48])+LEN("Vehicle Spaces:");FIND(",";[.X48];FIND("Vehicle Spaces:";[.X48]))-FIND("Vehicle Spaces:";[.X48])-LEN("Vehicle Spaces:"))) -> 195 | Z48: -73.979323314144 | AA48: 40.7726590949404 | AB48: (40.77265909494036, -73.97932331414397) | AC48: 12420 | AD48: 20 | AE48: 4 | AF48: 19 | AG48: 12
A49: 1213869-DCA | B49: Business | C49: 03/31/2023 | D49: Active | E49: 05/17/2006 | F49: Garage | G49: BROADWAY & 64TH PARKING LLC | H49: ICON PARKING | I49: 1900 | J49: BROADWAY | L49: NEW YORK | M49: NY | N49: 10023 | O49: 212-686-9800 | P49: Manhattan | Q49: 1 | R49: 107 | S49: 6 | T49: 1027472 | U49: 1011160501 | V49: MN14 | W49: 149 | X49: Vehicle Spaces: 400, Bicycle Spaces: 22 | Y49: of:==VALUE(MID([.X49];FIND("Vehicle Spaces:";[.X49])+LEN("Vehicle Spaces:");FIND(",";[.X49];FIND("Vehicle Spaces:";[.X49]))-FIND("Vehicle Spaces:";[.X49])-LEN("Vehicle Spaces:"))) -> 400 | Z49: -73.9821505530554 | AA49: 40.7715177562409 | AB49: (40.771517756240904, -73.98215055305542) | AC49: 12420 | AD49: 20 | AE49: 4 | AF49: 19 | AG49: 12
A50: 2105057-DCA | B50: Business | C50: 03/31/2023 | D50: Active | E50: 04/06/2022 | F50: Garage | G50: MP WEST END PARKING LLC | I50: 55 | J50: W END AVE | L50: NEW YORK | M50: NY | N50: 10023 | O50: 2124903460 | P50: Manhattan | Q50: 1 | R50: 107 | S50: 6 | T50: 1087719 | U50: 1011710063 | X50: Vehicle Spaces: 375, Bicycle Spaces: 22 | Y50: of:==VALUE(MID([.X50];FIND("Vehicle Spaces:";[.X50])+LEN("Vehicle Spaces:");FIND(",";[.X50];FIND("Vehicle Spaces:";[.X50]))-FIND("Vehicle Spaces:";[.X50])-LEN("Vehicle Spaces:"))) -> 375 | Z50: -73.9886811994225 | AA50: 40.7740574659745 | AB50: (40.77405746597447, -73.9886811994225) | AC50: 12420 | AD50: 20 | AE50: 4 | AF50: 19 | AG50: 12
A51: 2106765-DCA | B51: Business | C51: 03/31/2025 | D51: Active | E51: 06/14/2022 | F51: Garage and Parking Lot | G51: MP WEST 63 PARKING LLC | I51: 1886 | J51: BROADWAY | K51: 1886-1896 BROADWAY | L51: NEW YORK | M51: NY | N51: 10023 | O51: 2124903460 | P51: Manhattan | Q51: 1 | R51: 107 | S51: 6 | T51: 1027463 | U51: 1011157503 | X51: Vehicle Spaces: 75, Bicycle Spaces: 8 | Y51: of:==VALUE(MID([.X51];FIND("Vehicle Spaces:";[.X51])+LEN("Vehicle Spaces:");FIND(",";[.X51];FIND("Vehicle Spaces:";[.X51]))-FIND("Vehicle Spaces:";[.X51])-LEN("Vehicle Spaces:"))) -> 75 | Z51: -73.9821362936104 | AA51: 40.7708398034464 | AB51: (40.77083980344637, -73.98213629361037) | AC51: 12420 | AD51: 20 | AE51: 4 | AF51: 19 | AG51: 12
A52: 2019665-DCA | B52: Business | C52: 03/31/2023 | D52: Active | E52: 03/18/2015 | F52: Garage and Parking Lot | G52: 93RD STREET PARKING LLC | I52: 100 | J52: W 93RD ST | L52: NEW YORK | M52: NY | N52: 10025 | O52: 212-686-9800 | P52: Manhattan | Q52: 1 | R52: 107 | S52: 6 | T52: 1032526 | U52: 1012237503 | V52: MN12 | W52: 177 | X52: Vehicle Spaces: 127, Bicycle Spaces: 12 | Y52: of:==VALUE(MID([.X52];FIND("Vehicle Spaces:";[.X52])+LEN("Vehicle Spaces:");FIND(",";[.X52];FIND("Vehicle Spaces:";[.X52]))-FIND("Vehicle Spaces:";[.X52])-LEN("Vehicle Spaces:"))) -> 127 | Z52: -73.9689999236326 | AA52: 40.790950438038 | AB52: (40.79095043803797, -73.96899992363257) | AC52: 12422 | AD52: 20 | AE52: 4 | AF52: 19 | AG52: 15
A53: 1460563-DCA | B53: Business | C53: 03/31/2023 | D53: Active | E53: 03/22/2013 | F53: Garage | G53: LTG PARKING CORP. | I53: 185 | J53: W END AVE | L53: NEW YORK | M53: NY | N53: 10023 | P53: Manhattan | Q53: 1 | R53: 107 | S53: 6 | T53: 1070754 | U53: 1011790502 | V53: MN14 | W53: 155 | X53: Vehicle Spaces: 411, Bicycle Spaces: 22 | Y53: of:==VALUE(MID([.X53];FIND("Vehicle Spaces:";[.X53])+LEN("Vehicle Spaces:");FIND(",";[.X53];FIND("Vehicle Spaces:";[.X53]))-FIND("Vehicle Spaces:";[.X53])-LEN("Vehicle Spaces:"))) -> 411 | Z53: -73.9860086872017 | AA53: 40.7777213966728 | AB53: (40.777721396672796, -73.9860086872017) | AC53: 12420 | AD53: 20 | AE53: 4 | AF53: 19 | AG53: 12
A54: 2010013-DCA | B54: Business | C54: 03/31/2025 | D54: Active | E54: 06/26/2014 | F54: Garage | G54: MP WEST 97 LLC | I54: 122 | J54: W 97TH ST | L54: NEW YORK | M54: NY | N54: 10025 | O54: 2124903460 | P54: Manhattan | Q54: 1 | R54: 107 | S54: 7 | T54: 1079453 | U54: 1018510008 | V54: MN12 | W54: 181 | X54: Vehicle Spaces: 147, Bicycle Spaces: 14 | Y54: of:==VALUE(MID([.X54];FIND("Vehicle Spaces:";[.X54])+LEN("Vehicle Spaces:");FIND(",";[.X54];FIND("Vehicle Spaces:";[.X54]))-FIND("Vehicle Spaces:";[.X54])-LEN("Vehicle Spaces:"))) -> 147 | Z54: -73.9678970250993 | AA54: 40.7939117002221 | AB54: (40.79391170022211, -73.96789702509926) | AC54: 12422 | AD54: 20 | AE54: 4 | AF54: 23 | AG54: 15
A55: 2028771-DCA | B55: Business | C55: 03/31/2023 | D55: Active | E55: 09/23/2015 | F55: Garage | G55: AP RIVERSIDE MANAGEMENT LLC. | I55: 222 | J55: RIVERSIDE DR | L55: NEW YORK | M55: NY | N55: 10025 | O55: 2126638683 | P55: Manhattan | Q55: 1 | R55: 107 | S55: 6 | T55: 1076254 | U55: 1012537502 | V55: MN12 | W55: 183 | X55: Vehicle Spaces: 36, Bicycle Spaces: | Y55: of:==VALUE(MID([.X55];FIND("Vehicle Spaces:";[.X55])+LEN("Vehicle Spaces:");FIND(",";[.X55];FIND("Vehicle Spaces:";[.X55]))-FIND("Vehicle Spaces:";[.X55])-LEN("Vehicle Spaces:"))) -> 36 | Z55: -73.9761309371799 | AA55: 40.7950225701542 | AB55: (40.795022570154146, -73.97613093717986) | AC55: 12422 | AD55: 20 | AE55: 4 | AF55: 19 | AG55: 15
A56: 2088872-DCA | B56: Business | C56: 03/31/2023 | D56: Active | E56: 07/30/2019 | F56: Garage | G56: WEST 81ST GARAGE LLC | I56: 424 | J56: W END AVE | L56: NEW YORK | M56: NY | N56: 10024 | O56: 646-964-4323 | P56: Manhattan | Q56: 1 | R56: 107 | S56: 6 | T56: 1032674 | U56: 1012280061 | V56: MN12 | W56: 167 | X56: Vehicle Spaces: 83, Bicycle Spaces: 8 | Y56: of:==VALUE(MID([.X56];FIND("Vehicle Spaces:";[.X56])+LEN("Vehicle Spaces:");FIND(",";[.X56];FIND("Vehicle Spaces:";[.X56]))-FIND("Vehicle Spaces:";[.X56])-LEN("Vehicle Spaces:"))) -> 83 | Z56: -73.9804568775313 | AA56: 40.7852960572329 | AB56: (40.78529605723294, -73.98045687753125) | AC56: 12421 | AD56: 20 | AE56: 4 | AF56: 19 | AG56: 12
A57: 2098114-DCA | B57: Business | C57: 03/31/2023 | D57: Active | E57: 03/18/2021 | F57: Garage | G57: SP PLUS CORPORATION | I57: 60 | J57: W 66TH ST | L57: NEW YORK | M57: NY | N57: 10023 | O57: 2125025490 | P57: Manhattan | Q57: 1 | R57: 107 | S57: 6 | T57: 1028159 | U57: 1011180001 | X57: Vehicle Spaces: 80, Bicycle Spaces: 8 | Y57: of:==VALUE(MID([.X57];FIND("Vehicle Spaces:";[.X57])+LEN("Vehicle Spaces:");FIND(",";[.X57];FIND("Vehicle Spaces:";[.X57]))-FIND("Vehicle Spaces:";[.X57])-LEN("Vehicle Spaces:"))) -> 80 | Z57: -73.9804026881362 | AA57: 40.7731066759544 | AB57: (40.77310667595439, -73.98040268813617) | AC57: 12420 | AD57: 20 | AE57: 4 | AF57: 19 | AG57: 12
A58: 2089554-DCA | B58: Business | C58: 03/31/2023 | D58: Active | E58: 08/14/2019 | F58: Garage | G58: WEST 87TH GARAGE LLC | I58: 2373 | J58: BROADWAY | L58: NEW YORK | M58: NY | N58: 10024 | O58: 646-964-4323 | P58: Manhattan | Q58: 1 | R58: 107 | S58: 6 | T58: 1076251 | U58: 1012347501 | V58: MN12 | W58: 175 | X58: Vehicle Spaces: 124, Bicycle Spaces: 12 | Y58: of:==VALUE(MID([.X58];FIND("Vehicle Spaces:";[.X58])+LEN("Vehicle Spaces:");FIND(",";[.X58];FIND("Vehicle Spaces:";[.X58]))-FIND("Vehicle Spaces:";[.X58])-LEN("Vehicle Spaces:"))) -> 124 | Z58: -73.9761656987897 | AA58: 40.7887179312526 | AB58: (40.78871793125264, -73.97616569878966) | AC58: 12421 | AD58: 20 | AE58: 4 | AF58: 19 | AG58: 15
A59: 1157180-DCA | B59: Business | C59: 03/31/2023 | D59: Active | E59: 07/27/2005 | F59: Garage | G59: ALFRED CAR PARK, LLC | H59: GGMC | I59: 161 | J59: W 61ST ST | L59: NEW YORK | M59: NY | N59: 10023 | O59: 2129966363 | P59: Manhattan | Q59: 1 | R59: 107 | S59: 6 | T59: 1070131 | U59: 1011320501 | V59: MN14 | W59: 145 | X59: Vehicle Spaces: 140, Bicycle Spaces: 14 | Y59: of:==VALUE(MID([.X59];FIND("Vehicle Spaces:";[.X59])+LEN("Vehicle Spaces:");FIND(",";[.X59];FIND("Vehicle Spaces:";[.X59]))-FIND("Vehicle Spaces:";[.X59])-LEN("Vehicle Spaces:"))) -> 140 | Z59: -73.9860569482231 | AA59: 40.7714057608726 | AB59: (40.77140576087256, -73.98605694822305) | AC59: 12420 | AD59: 20 | AE59: 4 | AF59: 10 | AG59: 12
A60: 2096718-DCA | B60: Business | C60: 04/10/2023 | D60: Active | E60: 10/22/2020 | F60: Garage | G60: RIVERSIDE BLVD GARAGE LLC | I60: 100 | J60: RIVERSIDE BLVD | L60: NEW YORK | M60: NY | N60: 10069 | O60: 6465840409 | P60: Manhattan | Q60: 1 | R60: 107 | S60: 6 | T60: 1087705 | U60: 1011717505 | X60: Vehicle Spaces: 48, Bicycle Spaces: 0 | Y60: of:==VALUE(MID([.X60];FIND("Vehicle Spaces:";[.X60])+LEN("Vehicle Spaces:");FIND(",";[.X60];FIND("Vehicle Spaces:";[.X60]))-FIND("Vehicle Spaces:";[.X60])-LEN("Vehicle Spaces:"))) -> 48 | Z60: -73.9897207118602 | AA60: 40.7760063270789 | AB60: (40.7760063270789, -73.98972071186016) | AC60: 10091 | AD60: 20 | AE60: 4 | AF60: 19 | AG60: 12
A61: 2022433-DCA | B61: Business | C61: 03/31/2025 | D61: Active | E61: 05/08/2015 | F61: Garage | G61: SP PLUS CORPORATION | I61: 200 | J61: CENTRAL PARK W | L61: NEW YORK | M61: NY | N61: 10024 | O61: 2125025490 | P61: Manhattan | Q61: 1 | R61: 107 | S61: 6 | T61: 1083846 | U61: 1011300001 | V61: MN12 | W61: 165 | X61: Vehicle Spaces: 424, Bicycle Spaces: 22 | Y61: of:==VALUE(MID([.X61];FIND("Vehicle Spaces:";[.X61])+LEN("Vehicle Spaces:");FIND(",";[.X61];FIND("Vehicle Spaces:";[.X61]))-FIND("Vehicle Spaces:";[.X61])-LEN("Vehicle Spaces:"))) -> 424 | Z61: -73.972254181705 | AA61: 40.7813117649465 | AB61: (40.781311764946494, -73.97225418170498) | AC61: 12421 | AD61: 20 | AE61: 4 | AF61: 19 | AG61: 12
A62: 2053064-DCA | B62: Business | C62: 03/31/2023 | D62: Active | E62: 05/16/2017 | F62: Garage | G62: PRO PARK AMERICA NEW YORK, LLC | I62: 204 | J62: W 101ST ST | L62: NEW YORK | M62: NY | N62: 10025 | O62: 9174152749 | P62: Manhattan | Q62: 1 | R62: 107 | S62: 7 | T62: 1056484 | U62: 1018720037 | V62: MN12 | W62: 187 | X62: Vehicle Spaces: 300, Bicycle Spaces: 21 | Y62: of:==VALUE(MID([.X62];FIND("Vehicle Spaces:";[.X62])+LEN("Vehicle Spaces:");FIND(",";[.X62];FIND("Vehicle Spaces:";[.X62]))-FIND("Vehicle Spaces:";[.X62])-LEN("Vehicle Spaces:"))) -> 300 | Z62: -73.9684479333068 | AA62: 40.7974086370999 | AB62: (40.79740863709987, -73.96844793330676) | AC62: 12422 | AD62: 20 | AE62: 4 | AF62: 23 | AG62: 15
A63: 2100664-DCA | B63: Business | C63: 04/03/2023 | D63: Active | E63: 08/05/2021 | F63: Garage | G63: 200 WEST 67TH STREET GARAGE LLC | I63: 150 | J63: AMSTERDAM AVE | L63: NEW YORK | M63: NY | N63: 10023 | O63: 6465840409 | P63: Manhattan | Q63: 1 | R63: 107 | S63: 6 | T63: 1088576 | U63: 1011587507 | X63: Vehicle Spaces: 115, Bicycle Spaces: 12 | Y63: of:==VALUE(MID([.X63];FIND("Vehicle Spaces:";[.X63])+LEN("Vehicle Spaces:");FIND(",";[.X63];FIND("Vehicle Spaces:";[.X63]))-FIND("Vehicle Spaces:";[.X63])-LEN("Vehicle Spaces:"))) -> 115 | Z63: -73.9841859146737 | AA63: 40.7751465976123 | AB63: (40.77514659761228, -73.98418591467373) | AC63: 12420 | AD63: 20 | AE63: 4 | AF63: 19 | AG63: 12
A64: 2101647-DCA | B64: Business | C64: 03/31/2023 | D64: Active | E64: 09/21/2021 | F64: Garage | G64: CPW GARAGE LLC | I64: 455 | J64: CENTRAL PARK W | L64: NEW YORK | M64: NY | N64: 10025 | O64: 2122897200 | P64: Manhattan | Q64: 1 | R64: 107 | S64: 7 | T64: 1081578 | U64: 1018417503 | X64: Vehicle Spaces: 66, Bicycle Spaces: 7 | Y64: of:==VALUE(MID([.X64];FIND("Vehicle Spaces:";[.X64])+LEN("Vehicle Spaces:");FIND(",";[.X64];FIND("Vehicle Spaces:";[.X64]))-FIND("Vehicle Spaces:";[.X64])-LEN("Vehicle Spaces:"))) -> 66 | Z64: -73.960115355937 | AA64: 40.797938532329 | AB64: (40.79793853232898, -73.96011535593696) | AC64: 12422 | AD64: 20 | AE64: 4 | AF64: 23 | AG64: 15
A65: 1335617-DCA | B65: Business | C65: 03/31/2023 | D65: Active | E65: 07/26/2011 | F65: Garage | G65: GARSCH GARAGE CORP. | I65: 567 | J65: AMSTERDAM AVE | L65: NEW YORK | M65: NY | N65: 10024 | O65: 5169821398 | P65: Manhattan | Q65: 1 | R65: 107 | S65: 6 | T65: 1032228 | U65: 1012180001 | V65: MN12 | W65: 173 | X65: Vehicle Spaces: 150, Bicycle Spaces: 15 | Y65: of:==VALUE(MID([.X65];FIND("Vehicle Spaces:";[.X65])+LEN("Vehicle Spaces:");FIND(",";[.X65];FIND("Vehicle Spaces:";[.X65]))-FIND("Vehicle Spaces:";[.X65])-LEN("Vehicle Spaces:"))) -> 150 | Z65: -73.9743239976576 | AA65: 40.7886132358573 | AB65: (40.788613235857305, -73.97432399765763) | AC65: 12421 | AD65: 20 | AE65: 4 | AF65: 19 | AG65: 15
A66: 2101786-DCA | B66: Business | C66: 03/31/2023 | D66: Active | E66: 09/27/2021 | F66: Garage | G66: 157 WEST 83RD PARKING MANAGEMENT CORP. | I66: 157 | J66: W 83RD ST | L66: NEW YORK | M66: NY | N66: 10024 | O66: 2127367171 | P66: Manhattan | Q66: 1 | R66: 107 | S66: 6 | T66: 1032112 | U66: 1012140010 | X66: Vehicle Spaces: 182, Bicycle Spaces: 18 | Y66: of:==VALUE(MID([.X66];FIND("Vehicle Spaces:";[.X66])+LEN("Vehicle Spaces:");FIND(",";[.X66];FIND("Vehicle Spaces:";[.X66]))-FIND("Vehicle Spaces:";[.X66])-LEN("Vehicle Spaces:"))) -> 182 | Z66: -73.9751558586925 | AA66: 40.785201715449 | AB66: (40.785201715449034, -73.97515585869253) | AC66: 12421 | AD66: 20 | AE66: 4 | AF66: 19 | AG66: 12
A67: 2105514-DCA | B67: Business | C67: 03/31/2025 | D67: Active | E67: 04/25/2022 | F67: Garage | G67: MP CERTO 60 PARKING LLC | I67: 200 | J67: W 60TH ST | L67: NEW YORK | M67: NY | N67: 10023 | O67: 2124903460 | P67: Manhattan | Q67: 1 | R67: 107 | S67: 6 | T67: 1077845 | U67: 1011517501 | X67: Vehicle Spaces: 265, Bicycle Spaces: 21 | Y67: of:==VALUE(MID([.X67];FIND("Vehicle Spaces:";[.X67])+LEN("Vehicle Spaces:");FIND(",";[.X67];FIND("Vehicle Spaces:";[.X67]))-FIND("Vehicle Spaces:";[.X67])-LEN("Vehicle Spaces:"))) -> 265 | Z67: -73.9875769262716 | AA67: 40.7712247819981 | AB67: (40.77122478199811, -73.98757692627163) | AC67: 12081 | AD67: 20 | AE67: 4 | AF67: 19 | AG67: 12
A68: 2081211-DCA | B68: Business | C68: 03/31/2025 | D68: Active | E68: 01/08/2019 | F68: Garage | G68: LAZ PARKING NEW YORK/NEW JERSEY LLC | H68: LAZ PARKING NY LLC | I68: 140 | J68: RIVERSIDE BLVD | L68: NEW YORK | M68: NY | N68: 10069 | O68: 7184042575 | P68: Manhattan | Q68: 1 | R68: 107 | S68: 6 | T68: 1086066 | U68: 1011710133 | V68: MN14 | W68: 155 | X68: Vehicle Spaces: 41, Bicycle Spaces: 0 | Y68: of:==VALUE(MID([.X68];FIND("Vehicle Spaces:";[.X68])+LEN("Vehicle Spaces:");FIND(",";[.X68];FIND("Vehicle Spaces:";[.X68]))-FIND("Vehicle Spaces:";[.X68])-LEN("Vehicle Spaces:"))) -> 41 | Z68: -73.9889153449554 | AA68: 40.7772688314013 | AB68: (40.777268831401315, -73.98891534495534) | AC68: 10091 | AD68: 20 | AE68: 4 | AF68: 19 | AG68: 12
A69: 2010024-DCA | B69: Business | C69: 03/31/2025 | D69: Active | E69: 06/26/2014 | F69: Garage | G69: MP WEST 97 LLC | I69: 120 | J69: W 97TH ST | L69: NEW YORK | M69: NY | N69: 10025 | O69: 2124903460 | P69: Manhattan | Q69: 1 | R69: 107 | S69: 7 | T69: 1079308 | U69: 1018517501 | V69: MN12 | W69: 181 | X69: Vehicle Spaces: 147, Bicycle Spaces: 15 | Y69: of:==VALUE(MID([.X69];FIND("Vehicle Spaces:";[.X69])+LEN("Vehicle Spaces:");FIND(",";[.X69];FIND("Vehicle Spaces:";[.X69]))-FIND("Vehicle Spaces:";[.X69])-LEN("Vehicle Spaces:"))) -> 147 | Z69: -73.9678573061192 | AA69: 40.793895220774 | AB69: (40.793895220773955, -73.96785730611923) | AC69: 12422 | AD69: 20 | AE69: 4 | AF69: 23 | AG69: 15
A70: 2107029-DCA | B70: Business | C70: 03/31/2025 | D70: Active | E70: 06/27/2022 | F70: Garage and Parking Lot | G70: WEST 72ND STREET GARAGE LLC | I70: 15 | J70: W 72ND ST | L70: NEW YORK | M70: NY | N70: 10023 | P70: Manhattan | Q70: 1 | R70: 107 | S70: 6 | T70: 1028636 | U70: 1011250024 | X70: Vehicle Spaces: 200, Bicycle Spaces: 24 | Y70: of:==VALUE(MID([.X70];FIND("Vehicle Spaces:";[.X70])+LEN("Vehicle Spaces:");FIND(",";[.X70];FIND("Vehicle Spaces:";[.X70]))-FIND("Vehicle Spaces:";[.X70])-LEN("Vehicle Spaces:"))) -> 200 | Z70: -73.9771015332721 | AA70: 40.7767099078158 | AB70: (40.77670990781583, -73.97710153327209) | AC70: 12420 | AD70: 20 | AE70: 4 | AF70: 19 | AG70: 12
A71: 2054291-DCA | B71: Business | C71: 03/28/2023 | D71: Active | E71: 06/12/2017 | F71: Garage | G71: CHAMPION PARKING 92 LLC | I71: 114 | J71: W 92ND ST | L71: NEW YORK | M71: NY | N71: 10025 | O71: 2123085959 | P71: Manhattan | Q71: 1 | R71: 107 | S71: 6 | T71: 1032500 | U71: 1012220040 | V71: MN12 | W71: 177 | X71: Vehicle Spaces: 106, Bicycle Spaces: 10 | Y71: of:==VALUE(MID([.X71];FIND("Vehicle Spaces:";[.X71])+LEN("Vehicle Spaces:");FIND(",";[.X71];FIND("Vehicle Spaces:";[.X71]))-FIND("Vehicle Spaces:";[.X71])-LEN("Vehicle Spaces:"))) -> 106 | Z71: -73.9701051681716 | AA71: 40.7905884255091 | AB71: (40.79058842550907, -73.97010516817159) | AC71: 12422 | AD71: 20 | AE71: 4 | AF71: 19 | AG71: 15
A72: 1377817-DCA | B72: Business | C72: 03/31/2025 | D72: Active | E72: 12/02/2010 | F72: Garage | G72: COLUMBUS 60TH REALTY LLC | I72: 45 | J72: W 60TH ST | L72: NEW YORK | M72: NY | N72: 10023 | O72: 212-535-8670 | P72: Manhattan | Q72: 1 | R72: 107 | S72: 6 | T72: 1027187 | U72: 1011130001 | V72: MN14 | W72: 145 | X72: Vehicle Spaces: 220, Bicycle Spaces: 20 | Y72: of:==VALUE(MID([.X72];FIND("Vehicle Spaces:";[.X72])+LEN("Vehicle Spaces:");FIND(",";[.X72];FIND("Vehicle Spaces:";[.X72]))-FIND("Vehicle Spaces:";[.X72])-LEN("Vehicle Spaces:"))) -> 220 | Z72: -73.9831836459024 | AA72: 40.7693797595769 | AB72: (40.769379759576935, -73.98318364590243) | AC72: 12420 | AD72: 20 | AE72: 4 | AF72: 10 | AG72: 12
A73: 1198597-DCA | B73: Business | C73: 03/31/2025 | D73: Active | E73: 05/27/2005 | F73: Garage | G73: WEST 64TH STREET LLC | I73: 1930 | J73: BROADWAY | L73: NEW YORK | M73: NY | N73: 10023 | O73: 2125358670 | P73: Manhattan | Q73: 1 | R73: 107 | S73: 6 | T73: 1086193 | U73: 1011170001 | V73: MN14 | W73: 149 | X73: Vehicle Spaces: 150, Bicycle Spaces: 15 | Y73: of:==VALUE(MID([.X73];FIND("Vehicle Spaces:";[.X73])+LEN("Vehicle Spaces:");FIND(",";[.X73];FIND("Vehicle Spaces:";[.X73]))-FIND("Vehicle Spaces:";[.X73])-LEN("Vehicle Spaces:"))) -> 150 | Z73: -73.9821755505762 | AA73: 40.7725442924435 | AB73: (40.77254429244348, -73.98217555057616) | AC73: 12420 | AD73: 20 | AE73: 4 | AF73: 19 | AG73: 12
A74: 2096719-DCA | B74: Business | C74: 03/31/2025 | D74: Active | E74: 10/22/2020 | F74: Garage | G74: RIVERSIDE BLVD GARAGE LLC | I74: 80 | J74: RIVERSIDE BLVD | L74: NEW YORK | M74: NY | N74: 10069 | O74: 6465840409 | P74: Manhattan | Q74: 1 | R74: 107 | S74: 6 | T74: 1087720 | U74: 1011717507 | X74: Vehicle Spaces: 253, Bicycle Spaces: 21 | Y74: of:==VALUE(MID([.X74];FIND("Vehicle Spaces:";[.X74])+LEN("Vehicle Spaces:");FIND(",";[.X74];FIND("Vehicle Spaces:";[.X74]))-FIND("Vehicle Spaces:";[.X74])-LEN("Vehicle Spaces:"))) -> 253 | Z74: -73.9902298785091 | AA74: 40.7754848712916 | AB74: (40.77548487129163, -73.99022987850914) | AC74: 10091 | AD74: 20 | AE74: 4 | AF74: 19 | AG74: 12
A75: 2092475-DCA | B75: Business | C75: 03/31/2025 | D75: Active | E75: 11/25/2019 | F75: Garage and Parking Lot | G75: 214 WEST 88TH STREET GARAGE LLC | I75: 214 | J75: W 88TH ST | L75: NEW YORK | M75: NY | N75: 10024 | O75: 6465840409 | P75: Manhattan | Q75: 1 | R75: 107 | S75: 6 | T75: 1080398 | U75: 1012350042 | X75: Vehicle Spaces: 131, Bicycle Spaces: 13 | Y75: of:==VALUE(MID([.X75];FIND("Vehicle Spaces:";[.X75])+LEN("Vehicle Spaces:");FIND(",";[.X75];FIND("Vehicle Spaces:";[.X75]))-FIND("Vehicle Spaces:";[.X75])-LEN("Vehicle Spaces:"))) -> 131 | Z75: -73.974544066789 | AA75: 40.7891814441666 | AB75: (40.78918144416664, -73.97454406678902) | AC75: 12421 | AD75: 20 | AE75: 4 | AF75: 19 | AG75: 15
A76: 2001484-DCA | B76: Business | C76: 03/31/2025 | D76: Active | E76: 12/11/2013 | F76: Garage | G76: SP PLUS CORPORATION | I76: 214 | J76: W 80TH ST | L76: NEW YORK | M76: NY | N76: 10024 | O76: 2123217542 | P76: Manhattan | Q76: 1 | R76: 107 | S76: 6 | T76: 1032643 | U76: 1012270043 | V76: MN12 | W76: 167 | X76: Vehicle Spaces: 147, Bicycle Spaces: 14 | Y76: of:==VALUE(MID([.X76];FIND("Vehicle Spaces:";[.X76])+LEN("Vehicle Spaces:");FIND(",";[.X76];FIND("Vehicle Spaces:";[.X76]))-FIND("Vehicle Spaces:";[.X76])-LEN("Vehicle Spaces:"))) -> 147 | Z76: -73.9784820087821 | AA76: 40.7840962568377 | AB76: (40.78409625683772, -73.97848200878208) | AC76: 12421 | AD76: 20 | AE76: 4 | AF76: 19 | AG76: 12
A77: 2010019-DCA | B77: Business | C77: 03/31/2025 | D77: Active | E77: 06/26/2014 | F77: Garage | G77: MP WEST 97 LLC | I77: 135 | J77: W 96TH ST | L77: NEW YORK | M77: NY | N77: 10025 | O77: 2124903460 | P77: Manhattan | Q77: 1 | R77: 107 | S77: 7 | T77: 1085589 | U77: 1018510008 | V77: MN12 | W77: 181 | X77: Vehicle Spaces: 21, Bicycle Spaces: 0 | Y77: of:==VALUE(MID([.X77];FIND("Vehicle Spaces:";[.X77])+LEN("Vehicle Spaces:");FIND(",";[.X77];FIND("Vehicle Spaces:";[.X77]))-FIND("Vehicle Spaces:";[.X77])-LEN("Vehicle Spaces:"))) -> 21 | Z77: -73.9686376634698 | AA77: 40.7933327661226 | AB77: (40.79333276612264, -73.96863766346979) | AC77: 12422 | AD77: 20 | AE77: 4 | AF77: 23 | AG77: 15
A78: 2096165-DCA | B78: Business | C78: 03/31/2025 | D78: Active | E78: 08/11/2020 | F78: Garage | G78: TOWER 67 GARAGE LLC | I78: 150 | J78: W 68TH ST | L78: NEW YORK | M78: NY | N78: 10023 | O78: 6465840409 | P78: Manhattan | Q78: 1 | R78: 107 | S78: 6 | T78: 1028849 | U78: 1011390001 | X78: Vehicle Spaces: 158, Bicycle Spaces: 16 | Y78: of:==VALUE(MID([.X78];FIND("Vehicle Spaces:";[.X78])+LEN("Vehicle Spaces:");FIND(",";[.X78];FIND("Vehicle Spaces:";[.X78]))-FIND("Vehicle Spaces:";[.X78])-LEN("Vehicle Spaces:"))) -> 158 | Z78: -73.9826549133602 | AA78: 40.775684345866 | AB78: (40.77568434586604, -73.98265491336015) | AC78: 12420 | AD78: 20 | AE78: 4 | AF78: 19 | AG78: 12
A79: 2102377-DCA | B79: Business | C79: 05/07/2023 | D79: Active | E79: 10/29/2021 | F79: Garage | G79: 200 RIVERSIDE GARAGE LLC | I79: 200 | J79: RIVERSIDE BLVD | L79: NEW YORK | M79: NY | N79: 10069 | O79: 6465840409 | P79: Manhattan | Q79: 1 | R79: 107 | S79: 6 | T79: 1085722 | U79: 1011717501 | X79: Vehicle Spaces: 284, Bicycle Spaces: 21 | Y79: of:==VALUE(MID([.X79];FIND("Vehicle Spaces:";[.X79])+LEN("Vehicle Spaces:");FIND(",";[.X79];FIND("Vehicle Spaces:";[.X79]))-FIND("Vehicle Spaces:";[.X79])-LEN("Vehicle Spaces:"))) -> 284 | Z79: -73.9881928920154 | AA79: 40.7791049882072 | AB79: (40.77910498820722, -73.98819289201535) | AC79: 10091 | AD79: 20 | AE79: 4 | AF79: 19 | AG79: 12
A80: 2091314-DCA | B80: Business | C80: 03/31/2025 | D80: Active | E80: 10/10/2019 | F80: Garage | G80: SP PLUS CORPORATION | I80: 140 | J80: W 65TH ST | L80: NEW YORK | M80: NY | N80: 10023 | O80: 2126954568 | P80: Manhattan | Q80: 1 | R80: 107 | S80: 6 | T80: 1081023 | U80: 1011340001 | V80: MN14 | W80: 149 | X80: Vehicle Spaces: 721, Bicycle Spaces: 25 | Y80: of:==VALUE(MID([.X80];FIND("Vehicle Spaces:";[.X80])+LEN("Vehicle Spaces:");FIND(",";[.X80];FIND("Vehicle Spaces:";[.X80]))-FIND("Vehicle Spaces:";[.X80])-LEN("Vehicle Spaces:"))) -> 721 | Z80: -73.9834389353258 | AA80: 40.7735435657447 | AB80: (40.77354356574465, -73.9834389353258) | AC80: 12420 | AD80: 20 | AE80: 4 | AF80: 19 | AG80: 12
A81: 1342356-DCA | B81: Business | C81: 03/31/2025 | D81: Active | E81: 01/08/2010 | F81: Garage | G81: SESSANTA PARKING CO., LLC | I81: 229 | J81: W 60TH ST | L81: NEW YORK | M81: NY | N81: 10023 | O81: 2128429308 | P81: Manhattan | Q81: 1 | R81: 107 | S81: 6 | T81: 1087958 | U81: 1011520013 | V81: MN14 | W81: 147 | X81: Vehicle Spaces: 170, Bicycle Spaces: 17 | Y81: of:==VALUE(MID([.X81];FIND("Vehicle Spaces:";[.X81])+LEN("Vehicle Spaces:");FIND(",";[.X81];FIND("Vehicle Spaces:";[.X81]))-FIND("Vehicle Spaces:";[.X81])-LEN("Vehicle Spaces:"))) -> 170 | Z81: -73.9881364791966 | AA81: 40.7714773569677 | AB81: (40.77147735696765, -73.9881364791966) | AC81: 12420 | AD81: 20 | AE81: 4 | AF81: 19 | AG81: 12
A82: 1460704-DCA | B82: Business | C82: 03/31/2025 | D82: Active | E82: 03/29/2013 | F82: Garage | G82: ENTERPRISE 60TH STREET LLC | I82: 10 | J82: W END AVE | L82: NEW YORK | M82: NY | N82: 10023 | O82: 2125643199 | P82: Manhattan | Q82: 1 | R82: 107 | S82: 6 | T82: 1087651 | U82: 1011510502 | V82: MN14 | W82: 147 | X82: Vehicle Spaces: 150, Bicycle Spaces: | Y82: of:==VALUE(MID([.X82];FIND("Vehicle Spaces:";[.X82])+LEN("Vehicle Spaces:");FIND(",";[.X82];FIND("Vehicle Spaces:";[.X82]))-FIND("Vehicle Spaces:";[.X82])-LEN("Vehicle Spaces:"))) -> 150 | Z82: -73.9902159597983 | AA82: 40.7719222000216 | AB82: (40.77192220002161, -73.9902159597983) | AC82: 12081 | AD82: 20 | AE82: 4 | AF82: 19 | AG82: 12
A83: 2087136-DCA | B83: Business | C83: 03/31/2025 | D83: Active | E83: 06/12/2019 | F83: Garage | G83: UPPER WEST PARKING INC | I83: 303 | J83: W 96TH ST | L83: NEW YORK | M83: NY | N83: 10025 | O83: 3474487079 | P83: Manhattan | Q83: 1 | R83: 107 | S83: 6 | T83: 1057056 | U83: 1018870010 | V83: MN12 | W83: 183 | X83: Vehicle Spaces: 95, Bicycle Spaces: 10 | Y83: of:==VALUE(MID([.X83];FIND("Vehicle Spaces:";[.X83])+LEN("Vehicle Spaces:");FIND(",";[.X83];FIND("Vehicle Spaces:";[.X83]))-FIND("Vehicle Spaces:";[.X83])-LEN("Vehicle Spaces:"))) -> 95 | Z83: -73.9735015484936 | AA83: 40.795384299909 | AB83: (40.79538429990896, -73.97350154849359) | AC83: 12422 | AD83: 20 | AE83: 4 | AF83: 19 | AG83: 15
A84: 2110974-DCA | B84: Business | C84: 03/31/2025 | D84: Active | E84: 02/09/2023 | F84: Garage | G84: 205 WEST 101ST STREET GARAGE LLC | I84: 205 | J84: W 101ST ST | L84: NEW YORK | M84: NY | N84: 10025 | O84: 646 | P84: Manhattan | Q84: 1 | R84: 107 | S84: 7 | T84: 1056507 | U84: 1018730027 | X84: Vehicle Spaces: 300, Bicycle Spaces: 21 | Y84: of:==VALUE(MID([.X84];FIND("Vehicle Spaces:";[.X84])+LEN("Vehicle Spaces:");FIND(",";[.X84];FIND("Vehicle Spaces:";[.X84]))-FIND("Vehicle Spaces:";[.X84])-LEN("Vehicle Spaces:"))) -> 300 | Z84: -73.9684154251418 | AA84: 40.7974141176533 | AB84: (40.797414117653325, -73.96841542514183) | AC84: 12422 | AD84: 20 | AE84: 4 | AF84: 23 | AG84: 15
A85: 0427913-DCA | B85: Business | C85: 03/31/2025 | D85: Active | E85: 03/20/1997 | F85: Garage | G85: CA-LI AUTOMATIC TRANSMISSION CORP. | H85: A & S PARKING | I85: 103 | J85: W 108TH ST | L85: NEW YORK | M85: NY | N85: 10025 | O85: 2128640137 | P85: Manhattan | Q85: 1 | R85: 107 | S85: 8 | T85: 1056004 | U85: 1018630026 | V85: MN09 | W85: 193 | X85: Vehicle Spaces: 125, Bicycle Spaces: 13 | Y85: of:==VALUE(MID([.X85];FIND("Vehicle Spaces:";[.X85])+LEN("Vehicle Spaces:");FIND(",";[.X85];FIND("Vehicle Spaces:";[.X85]))-FIND("Vehicle Spaces:";[.X85])-LEN("Vehicle Spaces:"))) -> 125 | Z85: -73.962378341071 | AA85: 40.8007471493607 | AB85: (40.80074714936068, -73.96237834107102) | AC85: 12422 | AD85: 20 | AE85: 4 | AF85: 23 | AG85: 15
A86: 1125528-DCA | B86: Business | C86: 03/31/2025 | D86: Active | E86: 10/29/2002 | F86: Garage | G86: WORLD PARKING GARAGE LLC | I86: 1 | J86: CENTRAL PARK W | L86: NEW YORK | M86: NY | N86: 10023 | O86: 2125643199 | P86: Manhattan | Q86: 1 | R86: 107 | S86: 6 | T86: 1027191 | U86: 1011130502 | V86: MN14 | W86: 145 | X86: Vehicle Spaces: 88, Bicycle Spaces: 8 | Y86: of:==VALUE(MID([.X86];FIND("Vehicle Spaces:";[.X86])+LEN("Vehicle Spaces:");FIND(",";[.X86];FIND("Vehicle Spaces:";[.X86]))-FIND("Vehicle Spaces:";[.X86])-LEN("Vehicle Spaces:"))) -> 88 | Z86: -73.9815881687491 | AA86: 40.768528646228 | AB86: (40.76852864622802, -73.98158816874908) | AC86: 12420 | AD86: 20 | AE86: 4 | AF86: 10 | AG86: 12
A87: 2110975-DCA | B87: Business | C87: 03/31/2025 | D87: Active | E87: 02/09/2023 | F87: Garage | G87: 204 WEST 101ST STREET GARAGE LLC | I87: 204 | J87: W 101ST ST | L87: NEW YORK | M87: NY | N87: 10025 | O87: 646-584-0409 | P87: Manhattan | Q87: 1 | R87: 107 | S87: 7 | T87: 1056484 | U87: 1018720037 | X87: Vehicle Spaces: 300, Bicycle Spaces: 21 | Y87: of:==VALUE(MID([.X87];FIND("Vehicle Spaces:";[.X87])+LEN("Vehicle Spaces:");FIND(",";[.X87];FIND("Vehicle Spaces:";[.X87]))-FIND("Vehicle Spaces:";[.X87])-LEN("Vehicle Spaces:"))) -> 300 | Z87: -73.9684479333068 | AA87: 40.7974086370999 | AB87: (40.79740863709987, -73.96844793330676) | AC87: 12422 | AD87: 20 | AE87: 4 | AF87: 23 | AG87: 15
A88: 1249271-DCA | B88: Business | C88: 03/31/2025 | D88: Active | E88: 03/02/2007 | F88: Garage | G88: BARMAX GARAGE CORP. | I88: 203 | J88: W 77TH ST | L88: NEW YORK | M88: NY | N88: 10024 | O88: 2125643199 | P88: Manhattan | Q88: 1 | R88: 107 | S88: 6 | T88: 1030886 | U88: 1011690028 | V88: MN12 | W88: 163 | X88: Vehicle Spaces: 75, Bicycle Spaces: 8 | Y88: of:==VALUE(MID([.X88];FIND("Vehicle Spaces:";[.X88])+LEN("Vehicle Spaces:");FIND(",";[.X88];FIND("Vehicle Spaces:";[.X88]))-FIND("Vehicle Spaces:";[.X88])-LEN("Vehicle Spaces:"))) -> 75 | Z88: -73.9795587435898 | AA88: 40.7819637943078 | AB88: (40.78196379430775, -73.97955874358975) | AC88: 12421 | AD88: 20 | AE88: 4 | AF88: 19 | AG88: 12
A89: 1460793-DCA | B89: Business | C89: 03/31/2023 | D89: Active | E89: 03/26/2013 | F89: Garage | G89: LTG PARKING CORP. | I89: 205 | J89: W END AVE | L89: NEW YORK | M89: NY | N89: 10023 | P89: Manhattan | Q89: 1 | R89: 107 | S89: 6 | T89: 1070766 | U89: 1011790503 | V89: MN14 | W89: 155 | X89: Vehicle Spaces: 276, Bicycle Spaces: 20 | Y89: of:==VALUE(MID([.X89];FIND("Vehicle Spaces:";[.X89])+LEN("Vehicle Spaces:");FIND(",";[.X89];FIND("Vehicle Spaces:";[.X89]))-FIND("Vehicle Spaces:";[.X89])-LEN("Vehicle Spaces:"))) -> 276 | Z89: -73.9859327432881 | AA89: 40.7782895478532 | AB89: (40.77828954785315, -73.98593274328807) | AC89: 12420 | AD89: 20 | AE89: 4 | AF89: 19 | AG89: 12
A90: 1351985-DCA | B90: Business | C90: 03/31/2023 | D90: Active | E90: 04/28/2010 | F90: Garage | G90: CHAMPION PARKING 76 ST LLC. | I90: 205 | J90: W 76TH ST | L90: NEW YORK | M90: NY | N90: 10023 | O90: 2123085959 | P90: Manhattan | Q90: 1 | R90: 107 | S90: 6 | T90: 1087660 | U90: 1011680501 | V90: MN12 | W90: 163 | X90: Vehicle Spaces: 58, Bicycle Spaces: 6 | Y90: of:==VALUE(MID([.X90];FIND("Vehicle Spaces:";[.X90])+LEN("Vehicle Spaces:");FIND(",";[.X90];FIND("Vehicle Spaces:";[.X90]))-FIND("Vehicle Spaces:";[.X90])-LEN("Vehicle Spaces:"))) -> 58 | Z90: -73.9800752866667 | AA90: 40.7813435746943 | AB90: (40.78134357469427, -73.98007528666675) | AC90: 12420 | AD90: 20 | AE90: 4 | AF90: 19 | AG90: 12
A91: 2083767-DCA | B91: Business | C91: 03/31/2025 | D91: Active | E91: 03/27/2019 | F91: Garage | G91: SP PLUS CORPORATION | I91: 2420 | J91: BROADWAY | L91: NEW YORK | M91: NY | N91: 10024 | O91: 2123217621 | P91: Manhattan | Q91: 1 | R91: 107 | S91: 6 | T91: 1033308 | U91: 1012370017 | V91: MN12 | W91: 175 | X91: Vehicle Spaces: 51, Bicycle Spaces: 5 | Y91: of:==VALUE(MID([.X91];FIND("Vehicle Spaces:";[.X91])+LEN("Vehicle Spaces:");FIND(",";[.X91];FIND("Vehicle Spaces:";[.X91]))-FIND("Vehicle Spaces:";[.X91])-LEN("Vehicle Spaces:"))) -> 51 | Z91: -73.9749408863875 | AA91: 40.7903013815739 | AB91: (40.79030138157387, -73.9749408863875) | AC91: 12421 | AD91: 20 | AE91: 4 | AF91: 19 | AG91: 15
A92: 2053072-DCA | B92: Business | C92: 03/31/2023 | D92: Active | E92: 05/16/2017 | F92: Garage | G92: PROPARK AMERICA NEW YORK LLC | I92: 205 | J92: W 101ST ST | L92: NEW YORK | M92: NY | N92: 10025 | O92: 9174152415 | P92: Manhattan | Q92: 1 | R92: 107 | S92: 7 | T92: 1056507 | U92: 1018730027 | V92: MN12 | W92: 187 | X92: Vehicle Spaces: 300, Bicycle Spaces: 21 | Y92: of:==VALUE(MID([.X92];FIND("Vehicle Spaces:";[.X92])+LEN("Vehicle Spaces:");FIND(",";[.X92];FIND("Vehicle Spaces:";[.X92]))-FIND("Vehicle Spaces:";[.X92])-LEN("Vehicle Spaces:"))) -> 300 | Z92: -73.9684154251418 | AA92: 40.7974141176533 | AB92: (40.797414117653325, -73.96841542514183) | AC92: 12422 | AD92: 20 | AE92: 4 | AF92: 23 | AG92: 15
A93: 2001130-DCA | B93: Business | C93: 03/31/2025 | D93: Active | E93: 11/27/2013 | F93: Garage | G93: SP PLUS CORPORATION | I93: 189 | J93: W 89TH ST | L93: NEW YORK | M93: NY | N93: 10024 | O93: 2123217542 | P93: Manhattan | Q93: 1 | R93: 107 | S93: 6 | T93: 1085485 | U93: 1012200001 | V93: MN12 | W93: 173 | X93: Vehicle Spaces: 85, Bicycle Spaces: 9 | Y93: of:==VALUE(MID([.X93];FIND("Vehicle Spaces:";[.X93])+LEN("Vehicle Spaces:");FIND(",";[.X93];FIND("Vehicle Spaces:";[.X93]))-FIND("Vehicle Spaces:";[.X93])-LEN("Vehicle Spaces:"))) -> 85 | Z93: -73.9729730875118 | AA93: 40.7893567493064 | AB93: (40.789356749306386, -73.97297308751178) | AC93: 12421 | AD93: 20 | AE93: 4 | AF93: 19 | AG93: 15
A94: 2002932-DCA | B94: Business | C94: 03/31/2025 | D94: Active | E94: 01/27/2014 | F94: Garage | G94: SP PLUS CORPORATION | I94: 515 | J94: W 59TH ST | L94: NEW YORK | M94: NY | N94: 10019 | O94: 2125025490 | P94: Manhattan | Q94: 1 | R94: 107 | S94: 6 | T94: 1030308 | U94: 1011510017 | V94: MN14 | W94: 147 | X94: Vehicle Spaces: 195, Bicycle Spaces: 19 | Y94: of:==VALUE(MID([.X94];FIND("Vehicle Spaces:";[.X94])+LEN("Vehicle Spaces:");FIND(",";[.X94];FIND("Vehicle Spaces:";[.X94]))-FIND("Vehicle Spaces:";[.X94])-LEN("Vehicle Spaces:"))) -> 195 | Z94: -73.9883207380328 | AA94: 40.7707225725096 | AB94: (40.77072257250959, -73.98832073803278) | AC94: 12081 | AD94: 20 | AE94: 4 | AF94: 19 | AG94: 12
A95: 2064187-DCA | B95: Business | C95: 03/31/2023 | D95: Active | E95: 12/29/2017 | F95: Garage | G95: 254 WEST 79TH STREET PARKING CORP | I95: 252 | J95: W 79TH ST | L95: NEW YORK | M95: NY | N95: 10024 | O95: 212-736-7171 | P95: Manhattan | Q95: 1 | R95: 107 | S95: 6 | T95: 1030903 | U95: 1011707502 | V95: MN12 | W95: 167 | X95: Vehicle Spaces: 100, Bicycle Spaces: 10 | Y95: of:==VALUE(MID([.X95];FIND("Vehicle Spaces:";[.X95])+LEN("Vehicle Spaces:");FIND(",";[.X95];FIND("Vehicle Spaces:";[.X95]))-FIND("Vehicle Spaces:";[.X95])-LEN("Vehicle Spaces:"))) -> 100 | Z95: -73.9804103091091 | AA95: 40.7840197482034 | AB95: (40.784019748203356, -73.98041030910908) | AC95: 12421 | AD95: 20 | AE95: 4 | AF95: 19 | AG95: 12
A96: 0427085-DCA | B96: Business | C96: 03/31/2025 | D96: Active | E96: 06/01/1995 | F96: Garage | G96: FREMAN GARAGE CORP. | H96: MONTERAY GARAGE | I96: 137 | J96: W 89TH ST | L96: NEW YORK | M96: NY | N96: 10024 | O96: 2127244600 | P96: Manhattan | Q96: 1 | R96: 107 | S96: 6 | T96: 1032435 | U96: 1012200010 | V96: MN12 | W96: 173 | X96: Vehicle Spaces: 150, Bicycle Spaces: 15 | Y96: of:==VALUE(MID([.X96];FIND("Vehicle Spaces:";[.X96])+LEN("Vehicle Spaces:");FIND(",";[.X96];FIND("Vehicle Spaces:";[.X96]))-FIND("Vehicle Spaces:";[.X96])-LEN("Vehicle Spaces:"))) -> 150 | Z96: -73.9719151653136 | AA96: 40.7889145945531 | AB96: (40.78891459455307, -73.97191516531355) | AC96: 12421 | AD96: 20 | AE96: 4 | AF96: 19 | AG96: 15
Y97: of:=SUM([.Y2:.Y96]) -> 14873